Dis No,Year,Seq,Glide,Disaster Group,Disaster Subgroup,Disaster Type,Disaster Subtype,Disaster Subsubtype,Event Name,Country,ISO,Region,Continent,Location,Origin,Associated Dis,Associated Dis2,OFDA Response,Appeal,Declaration,AID Contribution ('000 US$),Dis Mag Value,Dis Mag Scale,Latitude,Longitude,Local Time,River Basin,Start Year,Start Month,Start Day,End Year,End Month,End Day,Total Deaths,No Injured,No Affected,No Homeless,Total Affected,Reconstruction Costs ('000 US$),"Reconstruction Costs, Adjusted ('000 US$)",Insured Damages ('000 US$),"Insured Damages, Adjusted ('000 US$)",Total Damages ('000 US$),"Total Damages, Adjusted ('000 US$)",CPI,Adm Level,Admin1 Code,Admin2 Code,Geo Locations
1968-0070-ZAF,1968,70,,Natural,Hydrological,Flood,,,,South Africa,ZAF,Southern Africa,Africa,Port Elizabeth,,,,,No,No,,,Km2,,,,,1968,9.0,1.0,1968,9.0,1.0,,,,,,,,,,30000.0,233706.0,12.8366149136235,,,,
1974-0012-ZAF,1974,12,,Natural,Hydrological,Flood,,,,South Africa,ZAF,Southern Africa,Africa,N. Natal,,,,,,,,,Km2,,,,,1974,2.0,10.0,1974,2.0,10.0,26.0,,,,,,,,,,,18.196991034332,,,,
1987-0166-ZAF,1987,166,,Natural,Hydrological,Flood,Riverine flood,,,South Africa,ZAF,Southern Africa,Africa,"Natal, Kwazulu",,,,Yes,No,No,,,Km2,,,,,1987,9.0,25.0,1987,9.0,29.0,506.0,,65000.0,,65000.0,,,248000.0,591423.0,765305.0,1825078.0,41.9327356221299,,,,
1993-0215-ZAF,1993,215,,Natural,Hydrological,Flood,Riverine flood,,,South Africa,ZAF,Southern Africa,Africa,Northern Natal province,Heavy rain,,,,No,No,,5890.0,Km2,,,,Umfolozi,1993,10.0,6.0,1993,10.0,8.0,12.0,,,15000.0,15000.0,,,,,,,53.3116203804942,,,,
1994-0632-ZAF,1994,632,,Natural,Hydrological,Flood,,,,South Africa,ZAF,Southern Africa,Africa,"Capetown, Cape Peninsula",,,,,,,,,Km2,,,,,1994,6.0,19.0,1994,6.0,19.0,,,11000.0,,11000.0,,,,,,,54.7016925431883,,,,
1995-0305-ZAF,1995,305,,Natural,Hydrological,Flood,Flash flood,,,South Africa,ZAF,Southern Africa,Africa,Pietermaritzburg region (Kwazulu Natal Province),Heavy rains,,,Yes,No,No,373.0,26830.0,Km2,,,,"Msunduze, Slangspruit",1995,12.0,25.0,1996,1.0,2.0,207.0,,4500.0,,4500.0,,,,,10000.0,17782.0,56.2363000218675,,,,
1996-0010-ZAF,1996,10,,Natural,Hydrological,Flood,Flash flood,,,South Africa,ZAF,Southern Africa,Africa,Kwazulu-Natal province,,,,,No,No,,,Km2,,,,,1996,1.0,12.0,1996,1.0,14.0,7.0,,,500.0,500.0,,,,,,,57.8847058823529,,,,
1996-0027-ZAF,1996,27,,Natural,Hydrological,Flood,Riverine flood,,,South Africa,ZAF,Southern Africa,Africa,"Mpumalanga, Gauteng, Free State, North West, Eastern Cape, KwaZulu-Natal provinces",Heavy rains,,,,No,No,,582300.0,Km2,,,,"Vaal, Queens, Crocodile, Limpopo, Olifants, Klein Letaba, Mogolo",1996,2.0,9.0,1996,2.0,19.0,27.0,30.0,7000.0,,7030.0,,,,,6860.0,11851.0,57.8847058823529,,,,
1997-0033-ZAF,1997,33,,Natural,Hydrological,Flood,,,,South Africa,ZAF,Southern Africa,Africa,Natal Province,,,,,,,,,Km2,,,,,1997,3.0,6.0,1997,3.0,6.0,,7.0,300.0,,307.0,,,,,,,59.2378657336541,,,,
1999-0426-ZAF,1999,426,,Natural,Hydrological,Flood,Flash flood,,,South Africa,ZAF,Southern Africa,Africa,city of Durban (Kwazulu-Natal Province),Brief torrential rain,,,,No,No,,,Km2,,,,,1999,10.0,26.0,1999,10.0,28.0,4.0,,300.0,,300.0,,,,,13300.0,21635.0,61.473667176908,,,,
1999-0593-ZAF,1999,593,,Natural,Hydrological,Flood,Riverine flood,,,South Africa,ZAF,Southern Africa,Africa,Durban city (KwaZulu Natal Province),Heavy rain,"Slide (land, mud, snow, rock)",,,No,No,,,Km2,,,,,1999,12.0,21.0,1999,12.0,23.0,23.0,,2000.0,,2000.0,,,,,6300.0,10248.0,61.473667176908,,,,
2000-0043-ZAF,2000,43,,Natural,Hydrological,Flood,Riverine flood,,,South Africa,ZAF,Southern Africa,Africa,"Mpumalanga, KwaZulu-Natal, Gauteng provinces",Heavy rain,,,Yes,,,,,Km2,,,,"Jukskei, Klip, Crocodile",2000,1.0,26.0,2000,3.0,27.0,83.0,,,200.0,200.0,,,50000.0,78679.0,160000.0,251772.0,63.5495473431008,1,2708;77311;77313,,"Gauteng, KwaZulu-Natal, Mpumalanga (Adm1)."
2000-0754-ZAF,2000,754,,Natural,Hydrological,Flood,Flash flood,,,South Africa,ZAF,Southern Africa,Africa,Kwazulu-Natal province,Brief torrential rain,,,,,,,25650.0,Km2,,,,"Mzingazi, Sikhwedezi, Nkonjane",2000,11.0,19.0,2000,11.0,23.0,3.0,,3000.0,,3000.0,,,,,,,63.5495473431008,1,77311,,KwaZulu-Natal (Adm1).
2000-0861-ZAF,2000,861,,Natural,Hydrological,Flood,Riverine flood,,,South Africa,ZAF,Southern Africa,Africa,KwaZulu-Natal province,,,,,,,,,Km2,,,,,2000,12.0,9.0,2000,12.0,9.0,7.0,,,,,,,,,,,63.5495473431008,1,77311,,KwaZulu-Natal (Adm1).
2001-0481-ZAF,2001,481,,Natural,Hydrological,Flood,,,,South Africa,ZAF,Southern Africa,Africa,City of Cape Town district (Western Cape province),,,,Yes,,,,,Km2,,,,,2001,7.0,3.0,2001,7.0,3.0,,,42356.0,,42356.0,,,,,,,65.345558714192,2,,77317,City of Cape Town Metropolitan Municipality (Adm2).
2001-0664-ZAF,2001,664,,Natural,Hydrological,Flood,Flash flood,,,South Africa,ZAF,Southern Africa,Africa,"Greater Tubatse area (Sekhukhune district, Limpopo province), Thembisile area (Nkangala district, Mpumalanga province), Ingwavuma, Ubombo, Jozini towns (Jozini area, Umkhanyakude district, KwaZulu-Natal province)",Brief torrential rain,Broken Dam/Burst bank,,,,,,752.0,Km2,,,,,2001,12.0,19.0,2001,12.0,22.0,5.0,12.0,300.0,,312.0,,,,,,,65.345558714192,2,,77335;77340;77355,"Nkangala District Municipality, Sekhukhune District Municipality, Umkhanyakude District Municipality (Adm2)."
2002-0514-ZAF,2002,514,,Natural,Hydrological,Flood,Riverine flood,,,South Africa,ZAF,Southern Africa,Africa,"East London town (Buffalo City district, Eastern Cape province)",Heavy rain,,,,,,,3000.0,Km2,,,,,2002,8.0,16.0,2002,8.0,18.0,16.0,,2500.0,,2500.0,,,,,,,66.3819636999782,2,,77316,Buffalo City Metropolitan Municipality (Adm2).
2003-0146-ZAF,2003,146,,Natural,Hydrological,Flood,Riverine flood,,,South Africa,ZAF,Southern Africa,Africa,"Montagu town (Langeberg area, Cape Winelands district, Western Cape province)",Heavy rains,,,,,,,660.0,Km2,,,,"Kigna, Keisie",2003,3.0,23.0,2003,3.0,26.0,1.0,,500.0,,500.0,,,,,,,67.8888956921058,2,,77327,Cape Winelands District Municipality (Adm2).
2004-0398-ZAF,2004,398,,Natural,Hydrological,Flood,Riverine flood,,,South Africa,ZAF,Southern Africa,Africa,City of Cape Town district (Western Cape province),Heavy rains,,,,,,,199.0,Km2,,,,,2004,8.0,7.0,2004,8.0,9.0,,,,15000.0,15000.0,,,,,,,69.7064421605073,2,,77317,City of Cape Town Metropolitan Municipality (Adm2).
2006-0181-ZAF,2006,181,,Natural,Hydrological,Flood,Riverine flood,,,South Africa,ZAF,Southern Africa,Africa,"Taung town (Greater Taung area, Dr Ruth Segomotsi Mompati district, North West province)",Heavy rain,,,,,,,2500.0,Km2,-27.44,24.83,,,2006,3.0,26.0,2006,3.0,30.0,6.0,,4160.0,,4160.0,127548.0,171444.0,,,71000.0,95435.0,74.3963874917997,2,,77348,Dr Ruth Segomotsi Mompati District Municipality (Adm2).
2006-0431-ZAF,2006,431,,Natural,Hydrological,Flood,Riverine flood,,,South Africa,ZAF,Southern Africa,Africa,"Eastern Cape, Western Cape provinces",Heavy rain,,,,,,,21840.0,Km2,-33.538,26.3,,Chatty river,2006,8.0,2.0,2006,8.0,4.0,6.0,,3000.0,,3000.0,,,,,145000.0,194902.0,74.3963874917997,1,2714;77310,,"Eastern Cape, Western Cape (Adm1)."
2007-0306-ZAF,2007,306,,Natural,Hydrological,Flood,Riverine flood,,,South Africa,ZAF,Southern Africa,Africa,"Cape Flats area (City of Cape Town district, Western Cape province)",Heavy rain and storms,,,,,,,20100.0,Km2,-34.09,19.58,,"Vygieskraal Canal, Eerste River",2007,7.0,27.0,2007,8.0,2.0,,,38000.0,,38000.0,,,,,,,76.5186792040236,2,,77317,City of Cape Town Metropolitan Municipality (Adm2).
2008-0245-ZAF,2008,245,FL-2008-000094,Natural,Hydrological,Flood,Riverine flood,,,South Africa,ZAF,Southern Africa,Africa,KwaZulu-Natal province,Heavy rains,,,,,,,25970.0,Km2,-29.67,31.09,,,2008,6.0,19.0,2008,6.0,19.0,11.0,,4000.0,,4000.0,,,,,1264.0,1591.0,79.4563043953641,1,77311,,KwaZulu-Natal (Adm1).
2009-0108-ZAF,2009,108,,Natural,Hydrological,Flood,Riverine flood,,,South Africa,ZAF,Southern Africa,Africa,KwaZulu Natal province,Heavy rain,,,,,,,,Km2,-29.41,30.82,,56340,2009,2.0,28.0,2009,3.0,3.0,3.0,,300.0,,300.0,,,,,,,79.1738027553029,1,77311,,KwaZulu-Natal (Adm1).
2009-0261-ZAF,2009,261,FL-2009-000133,Natural,Hydrological,Flood,Riverine flood,,,South Africa,ZAF,Southern Africa,Africa,City of Cape Town district (Western Cape province),Heavy rains,,,,,,,32700.0,Km2,-33.07,18.92,,,2009,7.0,12.0,2009,7.0,16.0,11.0,,20000.0,,20000.0,,,,,,,79.1738027553029,2,,77317,City of Cape Town Metropolitan Municipality (Adm2).
2011-0100-ZAF,2011,100,FL-2011-000007,Natural,Hydrological,Flood,Riverine flood,,,South Africa,ZAF,Southern Africa,Africa,"Buffalo City, Amathole, Joe Gqabi, O.R. Tambo, Alfred Nzo, Chris Hani districts (Eastern Cape province), Fezile Dabi, Thabo Mofutsanyane, Xhariep districts (Free State province), City of Johannesburg, Ekurhuleni, Sedibeng, West Rand districts (Gauteng province), Amajuba, eThekwini, iLembe, Sisonke, Ugu, Uthukela districts (KwaZulu-Natal province), Mopani, Sekhukhune, Vhembe, Waterberg districts (Limpopo province), Ehlanzeni, Nkangala districts (Mpumalanga province), Frances Baard, Namakwa, Pixley ka Seme, Siyanda districts (Northern Cape province), North West province",,,,Yes,,Yes,3093.0,124636.0,Km2,-31.055,28.41,,,2011,1.0,1.0,2011,2.0,4.0,40.0,321.0,200000.0,,200321.0,,,,,211000.0,254178.0,83.0126743931774,1;2,77314,77316;77320;77321;77322;77323;77324;77326;77328;77329;77331;77333;77337;77340;77341;77342;77343;77345;77351;77352;77353;77355;77356;77358;77359;77360;77361;77362;77363;77364,"North West (Adm1). Alfred Nzo District Municipality, Amajuba District Municipality, Amathole District Municipality, Buffalo City Metropolitan Municipality, Chris Hani District Municipality, City of Johannesburg Metropolitan Municipality, Ehlanzeni District Municipality, Ekurhuleni Metropolitan Municipality, eThekwini Metropolitan Municipality, Fezile Dabi District Municipality, Frances Baard District Municipality, iLembe District Municipality, Joe Gqabi District Municipality, Mopani District Municipality, Namakwa District Municipality, Nkangala District Municipality, O.R.Tambo District Municipality, Pixley ka Seme District Municipality, Sedibeng District Municipality, Sekhukhune District Municipality, Sisonke District Municipality, Siyanda District Municipality, Thabo Mofutsanyane District Municipality, Ugu District Municipality, Uthukela District Municipality, Vhembe District Municipality, Waterberg District Municipality, West Rand District Municipality, Xhariep District Municipality (Adm2)."
2012-0469-ZAF,2012,469,,Natural,Hydrological,Flood,Riverine flood,,,South Africa,ZAF,Southern Africa,Africa,"Bathurst, Port Alfred, Kenton-on-Sea towns (Ndlambe area, Cacadu district, Eastern Cape province), Grahamstown town (Makana area, Cacadu district, Eastern Cape province)",Heavy rains,,,,,,,14489.0,Km2,-32.93,26.56,,,2012,10.0,24.0,2012,10.0,29.0,13.0,,125000.0,,125000.0,,,,,200000.0,236043.0,84.7304788978789,2,,77319,Cacadu District Municipality (Adm2).
2014-0099-ZAF,2014,99,FL-2014-000038,Natural,Hydrological,Flood,Riverine flood,,,South Africa,ZAF,Southern Africa,Africa,"Gauteng, KwaZulu-Natal, Limpopo, Mpumalanga, North West provinces",Heavy and extented rainfall,"Slide (land, mud, snow, rock)",,,,,,1037639.0,Km2,-21.5153,25.61,,,2014,3.0,1.0,2014,3.0,18.0,32.0,,7185.0,,7185.0,,,,,85000.0,97292.0,87.3662978351193,1,2708;77311;77312;77313;77314,,"Gauteng, KwaZulu-Natal, Limpopo, Mpumalanga, North West (Adm1)."
2016-0305-ZAF,2016,305,,Natural,Hydrological,Flood,,,,South Africa,ZAF,Southern Africa,Africa,"Western Cape (Cape Town, Phillipi, Khayelitsha), Kwazulu Natal (Durban, Cato Manor, Amanzimtoti, Inanda, Ntuzuma, KwaMashu, uMlazi, Yellow Wood Park, Chatsworth -eThekwini Metropolitan Municipality, Ugu district)",Heavy rains,,,,,,,,Km2,,,,,2016,7.0,25.0,2016,8.0,3.0,7.0,,6900.0,,6900.0,,,146000.0,164835.0,180000.0,203221.0,88.573452875574,2,,77317;77329;77363,"City of Cape Town Metropolitan Municipality, eThekwini Metropolitan Municipality, Ugu District Municipality (Adm2)."
2016-0478-ZAF,2016,478,,Natural,Hydrological,Flood,Flash flood,,,South Africa,ZAF,Southern Africa,Africa,"Gauteng, KwaZulu Natal provinces",,,,,,,,,Km2,,,,Jukskei Rive,2016,11.0,9.0,2016,11.0,9.0,6.0,,600.0,,600.0,,,,,100000.0,112901.0,88.573452875574,1,2708;77311,,"Gauteng, KwaZulu-Natal (Adm1)."
2017-0217-ZAF,2017,217,,Natural,Hydrological,Flood,,,,South Africa,ZAF,Southern Africa,Africa,"KwaZulu-Natal, Nquthu (Umzinyathi District), Zinkwazi (Ilembe District), Mzingwenya (Uthungulu District), uMzumbe municipality, uMdoni, uMuziwabantu (Ugu)",,,,,,,,213687.0,Km2,-28.362,29.715,,,2017,5.0,14.0,2017,5.0,19.0,3.0,,200.0,,200.0,,,,,,,90.4601793133611,2,,77329;77332;77336;77337,"iLembe District Municipality, Ugu District Municipality, Umzinyathi District Municipality, Uthungulu District Municipality (Adm2)."
2019-0106-ZAF,2019,106,,Natural,Hydrological,Flood,,,,South Africa,ZAF,Southern Africa,Africa,"Ntuzuma,Verusalam, Inanda and KwaMashu towns (north of Durban city, KwaZulu-Natal Province)",Heavy rains,Storm,,,,,,,Km2,,,,,2019,3.0,8.0,2019,3.0,12.0,10.0,,,,,,,,,,,94.3490924994534,2,,77363,eThekwini Metropolitan Municipality (Adm2).
2019-0176-ZAF,2019,176,,Natural,Hydrological,Flood,,,,South Africa,ZAF,Southern Africa,Africa,"KwaZulu-Natal, Eastern Cape, Free state provinces",Heavy rains,"Slide (land, mud, snow, rock)",,,,,,,Km2,,,,,2019,4.0,21.0,2019,4.0,25.0,73.0,,1000.0,,1000.0,,,,,50000.0,52995.0,94.3490924994534,1,2707;77310;77311,,"Eastern Cape, Free State, KwaZulu-Natal (Adm1)."
2019-0182-ZAF,2019,182,,Natural,Hydrological,Flood,,,,South Africa,ZAF,Southern Africa,Africa,Eastern Cape Province,Heavy rains,,,,,,,,Km2,,,,,2019,5.0,2.0,2019,5.0,2.0,13.0,,,,,,,,,,,94.3490924994534,1,77310,,Eastern Cape (Adm1).
2019-0607-ZAF,2019,607,,Natural,Hydrological,Flood,,,,South Africa,ZAF,Southern Africa,Africa,Pretoria and Gauteng Province,Heavy rains,,,,,,,,Km2,,,,,2019,12.0,2.0,2019,12.0,11.0,2.0,,3500.0,,3500.0,,,,,,,94.3490924994534,1,2708,,Gauteng (Adm1).
2020-0050-ZAF,2020,50,,Natural,Hydrological,Flood,Flash flood,,,South Africa,ZAF,Southern Africa,Africa,Johannesburg and Gauteng Province,Heavy rains,,,,,,,,Km2,,,,,2020,2.0,7.0,2020,2.0,10.0,3.0,,200.0,,200.0,,,,,,,95.5129674174503,1,2708,,Gauteng (Adm1).
2021-0075-ZAF,2021,75,,Natural,Hydrological,Flood,,,,South Africa,ZAF,Southern Africa,Africa,"Mpumalanga Province, Free State Province and the area of Johannesburg and Pretoria, Limpopo, Mpumalanga, KwaZulu-Natal and Northern Cape Provinces",Heavy rains,,,,,,,,Km2,,,,,2021,2.0,1.0,2021,2.0,15.0,31.0,,400.0,,400.0,,,,,75000.0,75000.0,100.0,1;2,2707;77311;77312;77313;77315,77364;77367,"Free State, KwaZulu-Natal, Limpopo, Mpumalanga, Northern Cape (Adm1). City of Johannesburg Metropolitan Municipality, City of Tshwane Metropolitan Municipality (Adm2)."
2022-0009-ZAF,2022,9,,Natural,Hydrological,Flood,,,,South Africa,ZAF,Southern Africa,Africa,Eastern Cape Province,Heavy rains,,,,,,,,Km2,,,,,2022,1.0,8.0,2022,1.0,9.0,10.0,,,,,,,,,65000.0,,,1,77310,,Eastern Cape (Adm1).
2022-0035-ZAF,2022,35,,Natural,Hydrological,Flood,,,,South Africa,ZAF,Southern Africa,Africa,Ladysmith and Msinga (KwaZulu-Natal Province),Heavy rains,,,,,,,,Km2,,,,,2022,1.0,15.0,2022,1.0,16.0,1.0,,100.0,,100.0,,,,,99000.0,,,1,77311,,KwaZulu-Natal (Adm1).
2022-0077-ZAF,2022,77,,Natural,Hydrological,Flood,,,,South Africa,ZAF,Southern Africa,Africa,Gauteng Province; KwaZulu-Natal,Heavy rains,,,,,,,,Km2,,,,,2022,2.0,4.0,2022,2.0,5.0,3.0,,,138.0,138.0,,,,,,,,1,2708;77311,,"Gauteng, KwaZulu-Natal (Adm1)."
2022-0108-ZAF,2022,108,,Natural,Hydrological,Flood,,,,South Africa,ZAF,Southern Africa,Africa,Gauteng Province,Heavy rains,,,,,,,,Km2,,,,,2022,2.0,21.0,2022,2.0,22.0,4.0,,187.0,,187.0,,,,,,,,1,2708,,Gauteng (Adm1).
2022-0205-ZAF,2022,205,FL-2022-000201,Natural,Hydrological,Flood,,,,South Africa,ZAF,Southern Africa,Africa,"Umlazi Town (Durban, KwaZulu-Natal Province)",Heavy rains,"Slide (land, mud, snow, rock)",,,,Yes,,,Km2,,,,,2022,4.0,8.0,2022,4.0,18.0,544.0,50.0,135345.0,6895.0,142290.0,,,,,3000000.0,,,1,77311,,KwaZulu-Natal (Adm1).
2022-0313-ZAF,2022,313,,Natural,Hydrological,Flood,,,,South Africa,ZAF,Southern Africa,Africa,Durban (KwaZulu-Natal province),Heavy rains,,,,,,,,Km2,,,,,2022,5.0,22.0,2022,5.0,22.0,,,200.0,,200.0,,,,,,,,1,77311,,KwaZulu-Natal (Adm1).
2022-0356-ZAF,2022,356,,Natural,Hydrological,Flood,,,,South Africa,ZAF,Southern Africa,Africa,"Kleinvlei, Ravensmead, Goodwood, Strand, Bonteheuwel, Belhar, Maitland and Bellville South.(Cape Town)",Heavy rains,,,,,,,,Km2,,,,,2022,6.0,13.0,2022,6.0,15.0,,4.0,200.0,,204.0,,,,,,,,,,,
