Dis No,Year,Seq,Glide,Disaster Group,Disaster Subgroup,Disaster Type,Disaster Subtype,Disaster Subsubtype,Event Name,Country,ISO,Region,Continent,Location,Origin,Associated Dis,Associated Dis2,OFDA Response,Appeal,Declaration,AID Contribution ('000 US$),Dis Mag Value,Dis Mag Scale,Latitude,Longitude,Local Time,River Basin,Start Year,Start Month,Start Day,End Year,End Month,End Day,Total Deaths,No Injured,No Affected,No Homeless,Total Affected,Reconstruction Costs ('000 US$),"Reconstruction Costs, Adjusted ('000 US$)",Insured Damages ('000 US$),"Insured Damages, Adjusted ('000 US$)",Total Damages ('000 US$),"Total Damages, Adjusted ('000 US$)",CPI,Adm Level,Admin1 Code,Admin2 Code,Geo Locations
1993-0039-RUS,1993,39,,Natural,Hydrological,Flood,Riverine flood,,,Russian Federation (the),RUS,Eastern Europe,Europe,Districts of Serov and Krasnotyurinsk (Urals/Sverdlovsk Region),Heavy rain and Snowmelt,Broken Dam/Burst bank,,,No,No,,23270.0,Km2,,,,Kavka River,1993,6.0,13.0,1993,6.0,17.0,125.0,453.0,6500.0,,6953.0,,,,,34000.0,63776.0,53.3116203804942,,,,
1994-0088-RUS,1994,88,,Natural,Hydrological,Flood,Riverine flood,,,Russian Federation (the),RUS,Eastern Europe,Europe,"Kurgan, Belozyorsk (Urals), Westen Siberua, Bashkiria (Volga), Volgograde region",,,,,,,,350.0,Km2,,,,,1994,3.0,1.0,1994,3.0,1.0,1.0,,10204.0,,10204.0,,,,,,,54.7016925431883,,,,
1994-0758-RUS,1994,758,,Natural,Hydrological,Flood,Riverine flood,,,Russian Federation (the),RUS,Eastern Europe,Europe,Volga delta (Kalmykia republic),Heavy rain,,,,No,No,,,Km2,,,,,1994,3.0,17.0,1994,3.0,22.0,7.0,,1000.0,,1000.0,,,,,,,54.7016925431883,,,,
1994-0775-RUS,1994,775,,Natural,Hydrological,Flood,Riverine flood,,,Russian Federation (the),RUS,Eastern Europe,Europe,Bashkortosan (Ural mountains),Heavy rains,Broken Dam/Burst bank,,,No,No,,,Km2,,,,"Tirlyan reservoirs, Belaya",1994,8.0,5.0,1994,8.0,8.0,20.0,,1000.0,,1000.0,,,,,19000.0,34734.0,54.7016925431883,,,,
1994-0218-RUS,1994,218,,Natural,Hydrological,Flood,Riverine flood,,,Russian Federation (the),RUS,Eastern Europe,Europe,"Olginskiy, Lazovskiy (Primorskij region), Vladisvotok",Heavy rain,,,Yes,No,No,,25000.0,Km2,,,,"Ussuri, Lazovka, Avakumovka",1994,9.0,17.0,1994,9.0,26.0,18.0,,775000.0,429.0,775429.0,,,,,262000.0,478961.0,54.7016925431883,,,,
1996-0359-RUS,1996,359,,Natural,Hydrological,Flood,Riverine flood,,,Russian Federation (the),RUS,Eastern Europe,Europe,Irkoutsk region (Siberia),Heavy rains,,,,No,No,,614000.0,Km2,,,,,1996,7.0,3.0,1996,7.0,7.0,,,220000.0,,220000.0,,,,,158400.0,273647.0,57.8847058823529,,,,
1996-0471-RUS,1996,471,,Natural,Hydrological,Flood,Flash flood,,,Russian Federation (the),RUS,Eastern Europe,Europe,"North Primorye, Southern Khavarovsk",Brief torrential rain,,,,No,No,,524900.0,Km2,,,,,1996,8.0,1.0,1996,8.0,25.0,4.0,,14000.0,,14000.0,,,,,140000.0,241860.0,57.8847058823529,,,,
1997-0564-RUS,1997,564,,Natural,Hydrological,Flood,Riverine flood,,,Russian Federation (the),RUS,Eastern Europe,Europe,Krasny (Akskaisky region),Heavy rain,,,,No,No,,12910.0,Km2,,,,,1997,4.0,15.0,1997,4.0,17.0,2.0,,500.0,,500.0,,,,,174100.0,293900.0,59.2378657336541,,,,
1998-0608-RUS,1998,608,,Natural,Hydrological,Flood,Riverine flood,,,Russian Federation (the),RUS,Eastern Europe,Europe,Coast of Azov Sea to Krasnodar Kuban region,Snowmelt,Broken Dam/Burst bank,,,No,No,,,Km2,,,,,1998,2.0,18.0,1998,3.0,7.0,1.0,,88000.0,,88000.0,,,,,13000.0,21610.0,60.1574108900066,,,,
1998-0121-RUS,1998,121,,Natural,Hydrological,Flood,,,,Russian Federation (the),RUS,Eastern Europe,Europe,Veliky Ustyung,,,,,,,,,Km2,,,,,1998,5.0,7.0,1998,5.0,7.0,,,3500.0,,3500.0,,,,,,,60.1574108900066,,,,
1998-0179-RUS,1998,179,,Natural,Hydrological,Flood,Riverine flood,,,Russian Federation (the),RUS,Eastern Europe,Europe,Sakha-Yakutia region (Siberia),Ici jam,,,Yes,Yes,No,1549.0,,Km2,,,,,1998,5.0,16.0,1998,6.0,6.0,13.0,,42600.0,36000.0,78600.0,,,,,3500.0,5818.0,60.1574108900066,,,,
1998-0166-RUS,1998,166,,Natural,Hydrological,Flood,Riverine flood,,,Russian Federation (the),RUS,Eastern Europe,Europe,"Lenks, Sibary",,,,,,,,,Km2,,,,,1998,5.0,17.0,1998,5.0,17.0,,,20000.0,,20000.0,,,,,,,60.1574108900066,,,,
2000-0202-RUS,2000,202,,Natural,Hydrological,Flood,Riverine flood,,,Russian Federation (the),RUS,Eastern Europe,Europe,"Kurgan, Orenburg (Chelyabinskaya Oblast province)",,,,,,,,,Km2,,,,,2000,4.0,14.0,2000,4.0,14.0,1.0,,23000.0,,23000.0,,,,,,,63.5495473431008,1,2499,,Chelyabinskaya Oblast (Adm1).
2000-0278-RUS,2000,278,,Natural,Hydrological,Flood,,,,Russian Federation (the),RUS,Eastern Europe,Europe,"Aginskiy Buryatskiy A. Okrug, Altay Rep., Altayskiy Kray, Buryatiya Rep., Chitinskaya Oblast, Irkutskaya Oblast, Kemerovskaya Oblast, Khakasiya Rep., Krasnoyarskiy Kray, Novosibirskaya Oblast, Omskaya Oblast, Tomskaya Oblast, Tyva Rep., Ustordynskiy Buryatskiy Okrug",,,,,,,,,Km2,,,,,2000,5.0,13.0,2000,5.0,13.0,,,1200.0,,1200.0,,,,,,,63.5495473431008,1,2488;2489;2490;2497;2500;2506;2515;2517;2525;2541;2542;2563;2567;2570,,"Aginskiy Buryatskiy A. Okrug, Altay Rep., Altayskiy Kray, Buryatiya Rep., Chitinskaya Oblast, Irkutskaya Oblast, Kemerovskaya Oblast, Khakasiya Rep., Krasnoyarskiy Kray, Novosibirskaya Oblast, Omskaya Oblast, Tomskaya Oblast, Tyva Rep., Ustordynskiy Buryatskiy Okrug (Adm1)."
2000-0478-RUS,2000,478,,Natural,Hydrological,Flood,Riverine flood,,,Russian Federation (the),RUS,Eastern Europe,Europe,"Primorskiy Kray, Khabarovskiy Kray, Sakhalinskaya Oblast provinces",Heavy rain,,,,,,,192100.0,Km2,,,,,2000,7.0,30.0,2000,8.0,6.0,2.0,,24000.0,,24000.0,,,,,30000.0,47207.0,63.5495473431008,1,2516;2547;2552,,"Khabarovskiy Kray, Primorskiy Kray, Sakhalinskaya Oblast (Adm1)."
2000-0549-RUS,2000,549,,Natural,Hydrological,Flood,Coastal flood,,,Russian Federation (the),RUS,Eastern Europe,Europe,"Bolshoi, Dalnegorsk (Primorskiy Kray)",,,,,,,,,Km2,,,,,2000,8.0,28.0,2000,8.0,28.0,,,1181.0,,1181.0,,,,,1622.0,2552.0,63.5495473431008,1,2547,,Primorskiy Kray (Adm1).
2000-0612-RUS,2000,612,,Natural,Hydrological,Flood,,,,Russian Federation (the),RUS,Eastern Europe,Europe,"Primorskiy Kray, Sakhalinskaya Oblast, Koryakskiy Okrug provinces",,,,,,,,,Km2,,,,,2000,9.0,18.0,2000,9.0,18.0,,,1320.0,,1320.0,,,,,,,63.5495473431008,1,2522;2547;2552,,"Koryakskiy Okrug, Primorskiy Kray, Sakhalinskaya Oblast (Adm1)."
2001-0227-RUS,2001,227,,Natural,Hydrological,Flood,Riverine flood,,,Russian Federation (the),RUS,Eastern Europe,Europe,"Sakha Rep., Bashkortostan Rep., Tyva Rep., Krasnoyarskiy Kray provinces",Snowmelt,,,Yes,,,597.0,2857000.0,Km2,,,,"Lena, Aldan, Yenisei, Kacha, Tuba, Podkammennaya Tunguska, Yenisei Rivers, Ob, Biya and Katun, Belaya river",2001,5.0,12.0,2001,5.0,27.0,10.0,,50305.0,,50305.0,,,,,241000.0,368809.0,65.345558714192,1,2494;2525;2551;2567,,"Bashkortostan Rep., Krasnoyarskiy Kray, Sakha Rep., Tyva Rep. (Adm1)."
2001-0388-RUS,2001,388,,Natural,Hydrological,Flood,Coastal flood,,,Russian Federation (the),RUS,Eastern Europe,Europe,"Buryatiya Rep., Irkutskaya Oblast provinces",Extra-tropical cyclone,,,,,,,231500.0,Km2,,,,"Tunka, Oka, Slyudyanka. Upper reaches of Ob, Lena and Yenisei Rivers. Selenga and Uda Rivers",2001,7.0,7.0,2001,7.0,13.0,11.0,,300000.0,,300000.0,,,,,33000.0,50501.0,65.345558714192,1,2497;2506,,"Buryatiya Rep., Irkutskaya Oblast (Adm1)."
2001-0420-RUS,2001,420,,Natural,Hydrological,Flood,Riverine flood,,,Russian Federation (the),RUS,Eastern Europe,Europe,Vladivostok region (Primorskiy Kray province),Heavy rain,,,,,,,36650.0,Km2,,,,"Sedanka, Partizanskaya.",2001,8.0,6.0,2001,8.0,12.0,16.0,,25000.0,,25000.0,,,,,17000.0,26016.0,65.345558714192,1,2547,,Primorskiy Kray (Adm1).
2002-0024-RUS,2002,24,,Natural,Hydrological,Flood,Riverine flood,,,Russian Federation (the),RUS,Eastern Europe,Europe,"Krasnodar Temryuk, Anapa, Slavyank cities (Krasnodarskiy Kray province)",Snowmelt,,,,,,,9580.0,Km2,,,,Kuban,2002,1.0,6.0,2002,1.0,23.0,1.0,,3000.0,,3000.0,,,,,64970.0,97873.0,66.3819636999782,1,2524,,Krasnodarskiy Kray (Adm1).
2002-0376-RUS,2002,376,,Natural,Hydrological,Flood,Flash flood,,,Russian Federation (the),RUS,Eastern Europe,Europe,"Stavropolskiy Kray, Krasnodarskiy Kray , Karatchayevo-cherkesiya Rep., Ingushetiya Rep., Adygeya Rep., Chechnya Rep., Kabardino-balkariya Rep., Severnaya Osetiya-alaniya Rep., Dagestan Rep. provinces",Heavy rains,"Slide (land, mud, snow, rock)",,Yes,,,5018.0,224600.0,Km2,,,,"Kuban, Malka, Baksan, Terek, Kardonik, Argun, Sundzha, Laba, Belaya, Urup and Fars.",2002,6.0,19.0,2002,7.0,1.0,117.0,1200.0,329413.0,,330613.0,,,,,450000.0,677895.0,66.3819636999782,1,2487;2498;2503;2505;2508;2513;2524;2556;2558,,"Adygeya Rep., Chechnya Rep., Dagestan Rep., Ingushetiya Rep., Kabardino-balkariya Rep., Karatchayevo-cherkesiya Rep., Krasnodarskiy Kray, Severnaya Osetiya-alaniya Rep., Stavropolskiy Kray (Adm1)."
2002-0533-RUS,2002,533,,Natural,Hydrological,Flood,Riverine flood,,,Russian Federation (the),RUS,Eastern Europe,Europe,Vladivostok area (Primorskiy Kray province),Heavy rain,,,,,,,200.0,Km2,,,,"Razdolnaya, Migunovka and Komissarovka",2002,7.0,20.0,2002,7.0,26.0,,,1500.0,,1500.0,,,,,,,66.3819636999782,1,2547,,Primorskiy Kray (Adm1).
2002-0482-RUS,2002,482,,Natural,Hydrological,Flood,Riverine flood,,,Russian Federation (the),RUS,Eastern Europe,Europe,Novorossiisk (Krasnodarskiy Kray province),Heavy rain,,,,,,,10880.0,Km2,,,,,2002,8.0,8.0,2002,8.0,18.0,82.0,,48000.0,1500.0,49500.0,,,,,32000.0,48206.0,66.3819636999782,1,2524,,Krasnodarskiy Kray (Adm1).
2003-0393-RUS,2003,393,,Natural,Hydrological,Flood,Riverine flood,,,Russian Federation (the),RUS,Eastern Europe,Europe,"Chedikhol, Tandinsky districts (Tyva Rep. province)",Heavy rains,,,,,,,8220.0,Km2,,,,"Elegest, Duren",2003,7.0,29.0,2003,7.0,31.0,,,600.0,,600.0,,,,,,,67.8888956921058,1,2567,,Tyva Rep. (Adm1).
2004-0164-RUS,2004,164,,Natural,Hydrological,Flood,Riverine flood,,,Russian Federation (the),RUS,Eastern Europe,Europe,"Bryanskaya Oblast, Tverskaya Oblast, Chelyabinskaya Oblast, Moskva, Novgorodskaya Oblast, Mordoviya Rep. provinces",Rain and snowmelt,,,,,,,840000.0,Km2,,,,Dnepr,2004,3.0,30.0,2004,4.0,9.0,,,1220.0,,1220.0,,,,,1797.0,2578.0,69.7064421605073,1,2496;2499;2533;2535;2540;2565,,"Bryanskaya Oblast, Chelyabinskaya Oblast, Mordoviya Rep., Moskva, Novgorodskaya Oblast, Tverskaya Oblast (Adm1)."
2004-0172-RUS,2004,172,,Natural,Hydrological,Flood,Riverine flood,,,Russian Federation (the),RUS,Eastern Europe,Europe,"Krapivino (Kemerovskaya Oblast province), Biisk city (Altayskiy Kray province), Abaz city (Khakasiya Rep. province) ; Altay Rep., Altayskiy Kray, Tomskaya Oblast provinces","Rain, snowmelt",,,,,Yes,,264500.0,Km2,,,,"Kondoma, Malyshev Log, Tom, Maima, Udalushka, Isha, Biya, Chumysh, Abakan",2004,4.0,14.0,2004,5.0,18.0,18.0,,4800.0,,4800.0,,,16000.0,22953.0,50000.0,71729.0,69.7064421605073,1,2489;2490;2515;2517;2563,,"Altay Rep., Altayskiy Kray, Kemerovskaya Oblast, Khakasiya Rep., Tomskaya Oblast (Adm1)."
2004-0454-RUS,2004,454,,Natural,Hydrological,Flood,Riverine flood,,,Russian Federation (the),RUS,Eastern Europe,Europe,"Labinsk, Motovsk districts (Krasnodarskiy Kray province)",Heavy rain,Broken Dam/Burst bank,,,,,,830.0,Km2,,,,"Chalmyk, Okart",2004,8.0,31.0,2004,9.0,1.0,,,500.0,,500.0,,,,,4962.0,7118.0,69.7064421605073,1,2524,,Krasnodarskiy Kray (Adm1).
2005-0233-RUS,2005,233,,Natural,Hydrological,Flood,,,,Russian Federation (the),RUS,Eastern Europe,Europe,Leningradskaya Oblast province,,,,,,,,,Km2,,,,Tikhvinkha river,2005,4.0,15.0,2005,4.0,15.0,,,3685.0,,3685.0,,,,,,,72.0714104526569,1,2529,,Leningradskaya Oblast (Adm1).
2005-0276-RUS,2005,276,,Natural,Hydrological,Flood,Riverine flood,,,Russian Federation (the),RUS,Eastern Europe,Europe,"Dagestan Rep., Chechnya Rep. provinces",Heavy rains,"Slide (land, mud, snow, rock)",Broken Dam/Burst bank,,,,,,Km2,,,,,2005,5.0,9.0,2005,5.0,10.0,,,5000.0,,5000.0,,,,,21168.0,29371.0,72.0714104526569,1,2498;2503,,"Chechnya Rep., Dagestan Rep. (Adm1)."
2005-0285-RUS,2005,285,,Natural,Hydrological,Flood,Riverine flood,,,Russian Federation (the),RUS,Eastern Europe,Europe,"Sovestsky, Georgiyevsky, Podgornoya, Nezlobnaya, Krasnokumskaya, Mineralovodsky districts (Stavropolskiy Kray province)",Heavy rains,Broken Dam/Burst bank,,,,,,,Km2,,,,Kuma river,2005,5.0,11.0,2005,5.0,11.0,,,138.0,,138.0,,,,,2500.0,3469.0,72.0714104526569,1,2558,,Stavropolskiy Kray (Adm1).
2005-0458-RUS,2005,458,,Natural,Hydrological,Flood,Riverine flood,,,Russian Federation (the),RUS,Eastern Europe,Europe,Near Sotchi (Krasnodarskiy Kray province),Heavy rains,,,,,,,,Km2,,,,,2005,8.0,4.0,2005,8.0,4.0,19.0,,,,,,,,,,,72.0714104526569,1,2524,,Krasnodarskiy Kray (Adm1).
2006-0225-RUS,2006,225,,Natural,Hydrological,Flood,Riverine flood,,,Russian Federation (the),RUS,Eastern Europe,Europe,"Turochak, Biisk, Krasnogorskoye, Klepikovo, Barnaul cities (Altayskiy Kray province), Turochak city(Altay Rep. province)",Snowmelt,,,,,,,144900.0,Km2,50.78,87.14,,"Marutska, Biya, Katun, Kurya, Ob, Lebed",2006,4.0,21.0,2006,5.0,11.0,,,420.0,,420.0,,,,,7411.0,9962.0,74.3963874917997,1,2489;2490,,"Altay Rep., Altayskiy Kray (Adm1)."
2006-0306-RUS,2006,306,,Natural,Hydrological,Flood,Riverine flood,,,Russian Federation (the),RUS,Eastern Europe,Europe,"Lens, Olekminsk regions (Sakha Rep. province)","Rain and snowmelt, excessive dumping of water",Broken Dam/Burst bank,,,,,,274800.0,Km2,58.33,114.58,,"Upper Lena, Vitim",2006,6.0,4.0,2006,6.0,12.0,,,1300.0,,1300.0,,,,,125000.0,168019.0,74.3963874917997,1,2551,,Sakha Rep. (Adm1).
2006-0360-RUS,2006,360,,Natural,Hydrological,Flood,Riverine flood,,,Russian Federation (the),RUS,Eastern Europe,Europe,Dzhidinsky district (Buryatiya Rep. province),Heavy rain,,,,,,,22760.0,Km2,50.79,106.52,,Selenga river,2006,7.0,12.0,2006,7.0,14.0,,,6000.0,,6000.0,,,,,,,74.3963874917997,1,2497,,Buryatiya Rep. (Adm1).
2007-0180-RUS,2007,180,,Natural,Hydrological,Flood,Riverine flood,,,Russian Federation (the),RUS,Eastern Europe,Europe,Sakha Rep. province,"Snowmelt, Ice jam/break-up",,,,,,,313200.0,Km2,62.34,130.46,,"Lena, Matta, Amga, Vilyuia, Berezovka, Tatta",2007,5.0,13.0,2007,6.0,11.0,,,14000.0,,14000.0,,,,,25752.0,33655.0,76.5186792040236,1,2551,,Sakha Rep. (Adm1).
2010-0153-RUS,2010,153,FL-2010-000072,Natural,Hydrological,Flood,Riverine flood,,,Russian Federation (the),RUS,Eastern Europe,Europe,"Kividensky, Novoannensky, Olholvsky, Rudnyansky, Staropoltavsky, Kamishinsky distrcits (Volgogradskaya Oblast province)",Sharp increase in temperatures triggering melting snow,,,,,,,,Km2,,,,,2010,3.0,22.0,2010,3.0,26.0,,,3250.0,,3250.0,,,,,,,80.472285151979,1,2572,,Volgogradskaya Oblast (Adm1).
2010-0547-RUS,2010,547,FL-2010-000208,Natural,Hydrological,Flood,Riverine flood,,,Russian Federation (the),RUS,Eastern Europe,Europe,"Tuapsinskoye, Dzhubskoye, Novomichailovskoye cities, Velyaminivskoye, Georgievskoye, Shaumyanskoye, Shepsinskoye, Octyabrskoye, Tenginskoye villages (Tuapsinky area), Urinskoye village (Apsheronsky area) (Krasnodarskiy Kray province)",Torrential rains,,,,,,,,Km2,,,,,2010,10.0,16.0,2010,10.0,16.0,23.0,,45214.0,,45214.0,,,,,66000.0,82016.0,80.472285151979,1,2524,,Krasnodarskiy Kray (Adm1).
2011-0200-RUS,2011,200,FL-2011-000060,Natural,Hydrological,Flood,Riverine flood,,,Russian Federation (the),RUS,Eastern Europe,Europe,"Mykopsky, Koshehabisky, Giatinsky, Shovgenovsky, Krasnogvardeysky cities (Adygeya Republic), Dagestan city Krasnodarskiy Kray province)",Heavy rains,,,,,,,,Km2,,,,,2011,5.0,25.0,2011,5.0,30.0,,,10669.0,,10669.0,,,,,21015.0,25315.0,83.0126743931774,1,2487;2524,,"Adygeya Rep., Krasnodarskiy Kray (Adm1)."
2011-0340-RUS,2011,340,FL-2011-000123,Natural,Hydrological,Flood,Riverine flood,,,Russian Federation (the),RUS,Eastern Europe,Europe,"Oklyabrsky, Urus-Martanovsky, Achkhoy-Martanovsky districts (Chechnya Rep. province); Grozny city (Chechnya Rep. province)",Heavy rains,Broken Dam/Burst bank,,,,,,,Km2,,,,Sunja river,2011,8.0,26.0,2011,8.0,27.0,,,3500.0,,3500.0,,,,,,,83.0126743931774,1,2498,,Chechnya Rep. (Adm1).
2012-0243-RUS,2012,243,FL-2012-000063,Natural,Hydrological,Flood,Riverine flood,,,Russian Federation (the),RUS,Eastern Europe,Europe,"Rudniansky, Kamylshensky, Elansky districts (Volgogradskaya Oblast province)",,,,,,,,,Km2,,,,,2012,4.0,10.0,2012,4.0,10.0,,,2406.0,,2406.0,,,,,,,84.7304788978789,1,2572,,Volgogradskaya Oblast (Adm1).
2012-0111-RUS,2012,111,,Natural,Hydrological,Flood,Riverine flood,,,Russian Federation (the),RUS,Eastern Europe,Europe,"Ryazanskaya Oblast, Volgogradskaya Oblast provinces","Temperature, melting snow and spring rains",,,,,,,,Km2,,,,Mokcha,2012,4.0,22.0,2012,4.0,27.0,,,11871.0,,11871.0,,,,,17000.0,20064.0,84.7304788978789,1,2550;2572,,"Ryazanskaya Oblast, Volgogradskaya Oblast (Adm1)."
2012-0213-RUS,2012,213,FF-2012-000115,Natural,Hydrological,Flood,Flash flood,,,Russian Federation (the),RUS,Eastern Europe,Europe,"Gelendzhik, Divnomorskoye, Krymsk, Nizhnebakanskaya, Neberdzhaevskaya, Kabardinka, Novorossiysk cities (Krasnodarskiy Kray province)",,,,,,,,,Km2,,,,,2012,7.0,11.0,2012,7.0,11.0,172.0,3910.0,22000.0,5500.0,31410.0,,,30000.0,35406.0,600000.0,708128.0,84.7304788978789,1,2524,,Krasnodarskiy Kray (Adm1).
2012-0444-RUS,2012,444,,Natural,Hydrological,Flood,Riverine flood,,,Russian Federation (the),RUS,Eastern Europe,Europe,"Rostovskaya Oblast, Volgogradskaya Oblast, Kalmykiya Rep., Astrakhanskaya Oblast, Chechnya Rep., Dagestan Rep., Ingushetiya Rep., Adygeya Rep., Kabardino-balkariya Rep., Karatchayevo-cherkesiya Rep., Severnaya Osetiya-alaniya Rep., Krasnodarskiy Kray, Stavropolskiy Kray provinces",Torrential rains,,,,,,,10482.0,Km2,42.33,47.59,,,2012,10.0,9.0,2012,10.0,15.0,7.0,,1120.0,,1120.0,,,,,,,84.7304788978789,1,2487;2493;2498;2503;2505;2508;2510;2513;2524;2549;2556;2558;2572,,"Adygeya Rep., Astrakhanskaya Oblast, Chechnya Rep., Dagestan Rep., Ingushetiya Rep., Kabardino-balkariya Rep., Kalmykiya Rep., Karatchayevo-cherkesiya Rep., Krasnodarskiy Kray, Rostovskaya Oblast, Severnaya Osetiya-alaniya Rep., Stavropolskiy Kray, Volgogradskaya Oblast (Adm1)."
2013-0303-RUS,2013,303,,Natural,Hydrological,Flood,Riverine flood,,,Russian Federation (the),RUS,Eastern Europe,Europe,Novomikhaylovskiy city (Krasnodarskiy Kray province),Torrential rains,,,,,,,2432.0,Km2,44.3289,39.25,,,2013,2.0,20.0,2013,3.0,4.0,4.0,,1500.0,,1500.0,,,,,,,85.9716422479773,1,2524,,Krasnodarskiy Kray (Adm1).
2013-0278-RUS,2013,278,FL-2013-000100,Natural,Hydrological,Flood,Riverine flood,,,Russian Federation (the),RUS,Eastern Europe,Europe,"Zeya district (Amurskaya Oblast province) ; Yevreyskaya A. Oblast, Khabarovskiy Kray province",Heavy rains,,,,,Yes,,102479.0,Km2,50.0043,128.42,,"Amur, Zeya rivers",2013,8.0,1.0,2013,8.0,7.0,,,34135.0,,34135.0,,,,,1000000.0,1163174.0,85.9716422479773,1,2491;2516;2577,,"Amurskaya Oblast, Khabarovskiy Kray, Yevreyskaya A. Oblast (Adm1)."
2014-0193-RUS,2014,193,FL-2014-000073,Natural,Hydrological,Flood,Riverine flood,,,Russian Federation (the),RUS,Eastern Europe,Europe,"Altayskiy Kray, Altay Rep., Tyva Rep., Khakasiya Rep., Adygeya Rep. provinces",Torrential rains,,,,,,,1829701.0,Km2,,,,,2014,5.0,29.0,2014,6.0,10.0,6.0,2000.0,22545.0,,24545.0,,,,,8000.0,9157.0,87.3662978351193,1,2487;2489;2490;2517;2567,,"Adygeya Rep., Altay Rep., Altayskiy Kray, Khakasiya Rep., Tyva Rep. (Adm1)."
2015-0235-RUS,2015,235,,Natural,Hydrological,Flood,Riverine flood,,,Russian Federation (the),RUS,Eastern Europe,Europe,Sotchi city (Krasnodarskiy Kray province),,,,,,Yes,,,Km2,,,,Kherota river,2015,6.0,25.0,2015,6.0,25.0,1.0,,1500.0,,1500.0,,,,,,,87.4699322108025,1,2524,,Krasnodarskiy Kray (Adm1).
2016-0128-RUS,2016,128,,Natural,Hydrological,Flood,,,,Russian Federation (the),RUS,Eastern Europe,Europe,"Vologodskaya Oblast, Tyumenskaya Oblast, Sverdlovskaya Oblast provinces","Snwomelt, Ice jams and rising temperatures",,,,,,,1834048.0,Km2,61.967,59.803,,,2016,4.0,16.0,2016,4.0,22.0,,,3200.0,,3200.0,,,,,2000.0,2258.0,88.573452875574,1,2559;2566;2573,,"Sverdlovskaya Oblast, Tyumenskaya Oblast, Vologodskaya Oblast (Adm1)."
2016-0227-RUS,2016,227,,Natural,Hydrological,Flood,,,,Russian Federation (the),RUS,Eastern Europe,Europe,"Dagestan Rep., Chechnya Rep., Severnaya Osetiya-alaniya Rep. provinces",Torrential rains,"Slide (land, mud, snow, rock)",Storm,,,,,,Km2,,,,,2016,6.0,4.0,2016,6.0,10.0,,,8196.0,,8196.0,,,,,10000.0,11290.0,88.573452875574,1,2498;2503;2556,,"Chechnya Rep., Dagestan Rep., Severnaya Osetiya-alaniya Rep. (Adm1)."
2016-0295-RUS,2016,295,,Natural,Hydrological,Flood,,,,Russian Federation (the),RUS,Eastern Europe,Europe,"Moscou city (Moskva province and Moskovskaya Oblast province), Koursk city (Kurskaya Oblast province), Orel city (Orlovskaya Oblast province), Belgorod city (Belgorodskaya Oblast province)",Heavy rains,Lightening,,,,,,,Km2,,,,,2016,8.0,15.0,2016,8.0,15.0,,,300.0,,300.0,,,,,,,88.573452875574,1,2495;2527;2534;2535;2544,,"Belgorodskaya Oblast, Kurskaya Oblast, Moskovskaya Oblast, Moskva, Orlovskaya Oblast (Adm1)."
2017-0232-RUS,2017,232,FL-2017-000052,Natural,Hydrological,Flood,Flash flood,,,Russian Federation (the),RUS,Eastern Europe,Europe,"Cherlaksky, Bolsherechensky, Ust-Ishim (Omsk); Stavropol Kray; Ishim, Abatsky, Vikulovsky districts (Tyumen)",,,,,,,,,Km2,,,,,2017,5.0,10.0,2017,5.0,23.0,,,15721.0,,15721.0,,,,,,,90.4601793133611,1,2542;2566,,"Omskaya Oblast, Tyumenskaya Oblast (Adm1)."
2018-0113-RUS,2018,113,FL-2018-000046,Natural,Hydrological,Flood,,,,Russian Federation (the),RUS,Eastern Europe,Europe,"Tyva Republic, Altai Krai; Kumylzhensky, Mikhailovsky, Kikvidzensky, Frolovsky, Rudnyansky, Elansky, Novoannensky, Kletsky, Olkhovsky, Alekseevsky, Ilovlinsky, Uryupinsky (Volgorad region) - South Siberia",Melting snow,,,,,Yes,,172030.0,Km2,52.883,84.596,,,2018,3.0,25.0,2018,4.0,16.0,2.0,,3672.0,,3672.0,,,,,,,92.6696698010059,1,2490;2567;2572,,"Altayskiy Kray, Tyva Rep., Volgogradskaya Oblast (Adm1)."
2018-0407-RUS,2018,407,,Natural,Hydrological,Flood,,,,Russian Federation (the),RUS,Eastern Europe,Europe,Tuapse district (Krasnodar Krai),,Storm,,,,Yes,,,Km2,,,,,2018,10.0,24.0,2018,10.0,26.0,8.0,3.0,11300.0,,11303.0,,,,,10000.0,10791.0,92.6696698010059,1,2524,,Krasnodarskiy Kray (Adm1).
2019-0294-RUS,2019,294,,Natural,Hydrological,Flood,,,,Russian Federation (the),RUS,Eastern Europe,Europe,"Taishetsky, Nizhneudinsky, Tulunsky and Chunsky districts (Irkutsk Oblast; south-east Siberian Federal District)",Heavy rains,,,,,,,413323.0,Km2,58.911,102.485,,,2019,6.0,28.0,2019,7.0,3.0,31.0,190.0,33000.0,,33190.0,,,,,460000.0,487551.0,94.3490924994534,1,2506,,Irkutskaya Oblast (Adm1).
2019-0468-RUS,2019,468,,Natural,Hydrological,Flood,,,,Russian Federation (the),RUS,Eastern Europe,Europe,"Khabarovsk territory, Amur region (Far East Federal district); Irkutsk region (Siberia district)",,,,,,,,,Km2,,,,,2019,7.0,25.0,2019,7.0,31.0,,,7000.0,,7000.0,,,,,8000.0,8479.0,94.3490924994534,1,2491;2506;2516,,"Amurskaya Oblast, Irkutskaya Oblast, Khabarovskiy Kray (Adm1)."
2019-0432-RUS,2019,432,,Natural,Hydrological,Flood,,,,Russian Federation (the),RUS,Eastern Europe,Europe,Primorsky Territory,Heavy rains,,,,,Yes,,,Km2,,,,,2019,8.0,28.0,2019,8.0,31.0,,,10000.0,,10000.0,,,,,18000.0,19078.0,94.3490924994534,1,2547,,Primorskiy Kray (Adm1).
2019-0487-RUS,2019,487,,Natural,Hydrological,Flood,,,,Russian Federation (the),RUS,Eastern Europe,Europe,Kuragino village (Krasnoyarsk),,Broken Dam/Burst bank,Collapse,,,,,,Km2,,,,,2019,10.0,19.0,2019,10.0,19.0,28.0,14.0,,,14.0,,,,,,,94.3490924994534,1,2525,,Krasnoyarskiy Kray (Adm1).
2021-0483-RUS,2021,483,,Natural,Hydrological,Flood,,,,Russian Federation (the),RUS,Eastern Europe,Europe,Transbaikal and Khabarovsk Territories ( Amur Region); Jewish Autonomous Region,Heavy rains,,,,,,,,Km2,,,,,2021,6.0,24.0,2021,8.0,11.0,,,24000.0,,24000.0,,,,,200000.0,200000.0,100.0,1,2491;2577,,"Amurskaya Oblast, Yevreyskaya A. Oblast (Adm1)."
2021-0397-RUS,2021,397,,Natural,Hydrological,Flood,,,,Russian Federation (the),RUS,Eastern Europe,Europe,"Tuapse, Slavyansky, Seversky, Sochi, Goryachy Klyuch, and Gelendzhik (Krasnodar Region)",Heavy rains,Storm,,,,Yes,,4232.0,Km2,,,,Khorota and Matsesta Rivers,2021,7.0,4.0,2021,7.0,7.0,8.0,2.0,136.0,,138.0,,,,,,,100.0,1,2524,,Krasnodarskiy Kray (Adm1).
2021-0571-RUS,2021,571,,Natural,Hydrological,Flood,,,,Russian Federation (the),RUS,Eastern Europe,Europe,"Anapa, Slavyansky, Temryuk districts (Krasnodar Region)",Heavy rains,,,,,,,,Km2,,,,,2021,8.0,12.0,2021,8.0,14.0,,,4500.0,,4500.0,,,,,,,100.0,1,2524,,Krasnodarskiy Kray (Adm1).
2022-0473-RUS,2022,473,,Natural,Hydrological,Flood,,,,Russian Federation (the),RUS,Eastern Europe,Europe,"Lazarevsky, Khostinsky, Sochi regions",Heavy rains,,,,,Yes,,,Km2,,,,,2022,7.0,22.0,2022,7.0,25.0,1.0,,750.0,,750.0,,,,,,,,,,,
