Dis No,Year,Seq,Glide,Disaster Group,Disaster Subgroup,Disaster Type,Disaster Subtype,Disaster Subsubtype,Event Name,Country,ISO,Region,Continent,Location,Origin,Associated Dis,Associated Dis2,OFDA Response,Appeal,Declaration,AID Contribution ('000 US$),Dis Mag Value,Dis Mag Scale,Latitude,Longitude,Local Time,River Basin,Start Year,Start Month,Start Day,End Year,End Month,End Day,Total Deaths,No Injured,No Affected,No Homeless,Total Affected,Reconstruction Costs ('000 US$),"Reconstruction Costs, Adjusted ('000 US$)",Insured Damages ('000 US$),"Insured Damages, Adjusted ('000 US$)",Total Damages ('000 US$),"Total Damages, Adjusted ('000 US$)",CPI,Adm Level,Admin1 Code,Admin2 Code,Geo Locations
1990-0352-KEN,1990,352,,Natural,Hydrological,Flood,Riverine flood,,,Kenya,KEN,Eastern Africa,Africa,,,,,,No,No,,,Km2,,,,,1990,4.0,14.0,1990,4.0,15.0,44.0,,,,,,,,,,,48.2187972884321,,,,
1996-0474-KEN,1996,474,,Natural,Hydrological,Flood,Riverine flood,,,Kenya,KEN,Eastern Africa,Africa,Nyanza province,Heavy rains,,,,No,No,,,Km2,,,,,1996,4.0,6.0,1996,4.0,11.0,,,,1000.0,1000.0,,,,,,,57.8847058823529,,,,
2001-0032-KEN,2001,32,,Natural,Hydrological,Flood,Riverine flood,,,Kenya,KEN,Eastern Africa,Africa,Nairobi district (Nairobi province),Heavy rain,,,,,,,,Km2,,,,,2001,1.0,13.0,2001,1.0,14.0,4.0,,,,,,,,,38.0,58.0,65.345558714192,2,,51360,Nairobi (Adm2).
2002-0265-KEN,2002,265,,Natural,Hydrological,Flood,Riverine flood,,,Kenya,KEN,Eastern Africa,Africa,"Migori, Kisumu, Nyando, Rachuonyo districts (Nyanza province), Kirinyaga, Muranga, Thika districts (Central province), Busia districts (Western province), Ijara district (North Eastern province)",Heavy rain,"Slide (land, mud, snow, rock)",,,,,5621.0,,Km2,,,,"Mara, Tana, Sabaki",2002,4.0,26.0,2002,5.0,28.0,53.0,8.0,150000.0,,150008.0,,,,,,,66.3819636999782,2,,51334;51336;51339;51354;51355;51356;51362;51369;51371;51373;51374;51396,"Busia, Ijara, Kirinyaga, Kisumu, Meru Central, Meru North, Meru South, Migori, Muranga, Nyando, Rachuonyo, Thika (Adm2)."
2002-0689-KEN,2002,689,,Natural,Hydrological,Flood,Riverine flood,,,Kenya,KEN,Eastern Africa,Africa,"Madogo area (Tana River district, Coast province), Kinango area (Kwale district, Coast province)",Heavy rain,,,,,,,77900.0,Km2,,,,,2002,10.0,29.0,2002,11.0,4.0,14.0,,20000.0,,20000.0,,,,,,,66.3819636999782,2,,51341;51346,"Kwale, Tana River (Adm2)."
2002-0711-KEN,2002,711,,Natural,Hydrological,Flood,Flash flood,,,Kenya,KEN,Eastern Africa,Africa,Kiambu district (Central province),"Dam/levy, break or release",,,,,,,920.0,Km2,,,,Riara,2002,11.0,17.0,2002,11.0,20.0,12.0,,2000.0,,2000.0,,,,,,,66.3819636999782,2,,51333,Kiambu (Adm2).
2002-0800-KEN,2002,800,,Natural,Hydrological,Flood,Riverine flood,,,Kenya,KEN,Eastern Africa,Africa,"Marigat area (Baringo district, Rift Valley province)",Heavy rain,,,,,,,750.0,Km2,,,,Perkerra,2002,12.0,21.0,2002,12.0,23.0,6.0,,3000.0,,3000.0,,,,,,,66.3819636999782,2,,51377,Baringo (Adm2).
2003-0729-KEN,2003,729,,Natural,Hydrological,Flood,Riverine flood,,,Kenya,KEN,Eastern Africa,Africa,Kisumu district (Nyanza province),Heavy rains,,,,,,,390.0,Km2,,,,Auji,2003,1.0,4.0,2003,1.0,6.0,,,300.0,,300.0,,,,,,,67.8888956921058,2,,51369,Kisumu (Adm2).
2004-0194-KEN,2004,194,,Natural,Hydrological,Flood,Riverine flood,,,Kenya,KEN,Eastern Africa,Africa,"Nairobi district (Nairobi province), Tana River, Taita Taveta districts (Coast province), Nakuru, Baringo, Turkana, Marakwet districts (Rift Valley province), Machakos district (Eastern province), Nyamira, Nyando, Rachuonyo, Kisumu, Migori, Homa Bay districts (Nyanza province)",Heavy rains,"Slide (land, mud, snow, rock)",,,,,,268300.0,Km2,,,,"Nyando, Mahenya, Sondu-Miriu, Sio, Awach, Ombeyi, Migori and Kuja, Tonde, Chemoron, Endao, Miriu, Athi, Nzoia, Thirikwa, Ndarugu, Thiriku, Ruamuthambi, Kirichwa, Ruarakaother, Athi",2004,4.0,9.0,2004,5.0,11.0,50.0,,10000.0,,10000.0,,,,,,,69.7064421605073,2,,51345;51346;51350;51360;51368;51369;51371;51372;51373;51374;51377;51385;51386;51392,"Baringo, Homa Bay, Kisumu, Machakos, Marakwet, Migori, Nairobi, Nakuru, Nyamira, Nyando, Rachuonyo, Taita Taveta, Tana River, Turkana (Adm2)."
2004-0152-KEN,2004,152,,Natural,Hydrological,Flood,Flash flood,,,Kenya,KEN,Eastern Africa,Africa,"Nyando district (Nyanza province), Busia district (Western province)",Heavy rain,,,,,,,8880.0,Km2,,,,Nyando,2004,4.0,9.0,2004,4.0,12.0,4.0,,2000.0,,2000.0,,,,,,,69.7064421605073,2,,51373;51396,"Busia, Nyando (Adm2)."
2005-0215-KEN,2005,215,,Natural,Hydrological,Flood,Flash flood,,,Kenya,KEN,Eastern Africa,Africa,"Isiolo district (Eastern province), Garissa district (North Eastern province), Western, Nyanza provinces",Heavy rains,,,,,,,,Km2,,,,,2005,4.0,23.0,2005,4.0,26.0,1.0,,25000.0,,25000.0,,,,,500.0,694.0,72.0714104526569,1;2,51330;51332,51348;51361,"Nyanza, Western (Adm1). Garissa, Isiolo (Adm2)."
2005-0260-KEN,2005,260,,Natural,Hydrological,Flood,Flash flood,,,Kenya,KEN,Eastern Africa,Africa,"Dadaab town (Garissa district, North Eastern province), Rift Valley, Western provinces",Heavy rains,,,,,,,,Km2,,,,,2005,5.0,18.0,2005,5.0,24.0,5.0,,10000.0,,10000.0,,,,,,,72.0714104526569,1;2,51331;51332,51361,"Rift Valley, Western (Adm1). Garissa (Adm2)."
2005-0526-KEN,2005,526,,Natural,Hydrological,Flood,Riverine flood,,,Kenya,KEN,Eastern Africa,Africa,"Bukhay, Walwasi areas (Busia district, Western province)",Heavy rain,,,,,,,3520.0,Km2,,,,,2005,6.0,17.0,2005,6.0,20.0,20.0,,1200.0,,1200.0,,,,,,,72.0714104526569,2,,51396,Busia (Adm2).
2006-0178-KEN,2006,178,,Natural,Hydrological,Flood,Riverine flood,,,Kenya,KEN,Eastern Africa,Africa,"Isiolo, Moyale districts (Eastern province), Nairobi districts (Nairobi province)",Heavy rains,,,,,,,538000.0,Km2,2.25,37.53,,"Uaso Nyiro, Sabaki, Tana, Migori, Kuja, Nzoia, Nyando, Genale Wenz",2006,4.0,4.0,2006,5.0,22.0,60.0,,17300.0,,17300.0,,,,,,,74.3963874917997,2,,51348;51357;51360,"Isiolo, Moyale, Nairobi (Adm2)."
2006-0234-KEN,2006,234,,Natural,Hydrological,Flood,Riverine flood,,,Kenya,KEN,Eastern Africa,Africa,"Nyanza, Coast, Western provinces",Heavy rain,,,,,,,,Km2,,,,,2006,4.0,25.0,2006,5.0,4.0,8.0,,13000.0,,13000.0,,,,,,,74.3963874917997,1,51326;51330;51332,,"Coast, Nyanza, Western (Adm1)."
2006-0587-KEN,2006,587,,Natural,Hydrological,Flood,Riverine flood,,,Kenya,KEN,Eastern Africa,Africa,"Moyale, Isiolo districts (Eastern province), Mandera, Garissa, Wajir districts (North Eastern province), Turkana district (Rift Valley province), Kwale, Mombasa districts (Coast province)",Heavy rain,,,,,,,,Km2,-3.24,40.01,,Ewaso Nyiro,2006,10.0,15.0,2006,10.0,26.0,30.0,,30000.0,,30000.0,,,,,,,74.3963874917997,2,,51341;51344;51348;51357;51361;51363;51364;51392,"Garissa, Isiolo, Kwale, Mandera, Mombasa, Moyale, Turkana, Wajir (Adm2)."
2006-0624-KEN,2006,624,,Natural,Hydrological,Flood,Riverine flood,,,Kenya,KEN,Eastern Africa,Africa,"Garissa, Ijara, Wajir, Mandera districts (North Eastern province), Kilifi, Tana River, Kwale districts (Coast province), Moyale, Isiolo districts (Eastern province), Busia district (Western province), Turkana district (Rift Valley province), Kisumu district (Nyanza province)",Torrential rain,,,,,,50041.0,,Km2,,,,,2006,10.0,23.0,2006,12.0,19.0,114.0,,723000.0,,723000.0,,,,,,,74.3963874917997,2,,51340;51341;51346;51348;51357;51361;51362;51363;51364;51369;51392;51396,"Busia, Garissa, Ijara, Isiolo, Kilifi, Kisumu, Kwale, Mandera, Moyale, Tana River, Turkana, Wajir (Adm2)."
2007-0177-KEN,2007,177,FL-2007-000076,Natural,Hydrological,Flood,Riverine flood,,,Kenya,KEN,Eastern Africa,Africa,"Mombasa, Malindi, Kwale, Kilifi, Lamu districts (Coast provinces)",Heavy rain,,,,,,,13870.0,Km2,-3.59,39.76,,"Mwakuhenga, Mkuru",2007,5.0,15.0,2007,6.0,11.0,2.0,1.0,650.0,,651.0,,,,,,,76.5186792040236,2,,51340;51341;51342;51343;51344,"Kilifi, Kwale, Lamu, Malindi, Mombasa (Adm2)."
2007-0408-KEN,2007,408,FL-2007-000138,Natural,Hydrological,Flood,Riverine flood,,,Kenya,KEN,Eastern Africa,Africa,Busia district (Western province),heavy rain,Broken Dam/Burst bank,,,,,,53520.0,Km2,0.88,34.28,,"Kenya-Nzoia, Sabwani, Malakisi, Malaba",2007,8.0,15.0,2007,10.0,31.0,13.0,,40000.0,,40000.0,,,,,,,76.5186792040236,2,,51396,Busia (Adm2).
2007-0613-KEN,2007,613,,Natural,Hydrological,Flood,Riverine flood,,,Kenya,KEN,Eastern Africa,Africa,Taita Taveta district (Coast province),Heavy rains,"Slide (land, mud, snow, rock)",,,,,,6200.0,Km2,-3.61,38.69,,,2007,12.0,12.0,2007,12.0,15.0,4.0,,2000.0,,2000.0,,,,,,,76.5186792040236,2,,51345,Taita Taveta (Adm2).
2008-0127-KEN,2008,127,,Natural,Hydrological,Flood,Riverine flood,,,Kenya,KEN,Eastern Africa,Africa,Taita Taveta district (Coast province),Heavy rain,,,,,,,12190.0,Km2,-3.38,38.17,,"Voi, Lumi, Ruvu, Lake Jipe tributaries",2008,3.0,17.0,2008,4.0,5.0,,,700.0,,700.0,,,,,,,79.4563043953641,2,,51345,Taita Taveta (Adm2).
2008-0129-KEN,2008,129,,Natural,Hydrological,Flood,,,,Kenya,KEN,Eastern Africa,Africa,"Chalbi area (Marsabit district, Eastern province), Rachuonyo district (Nyanza province)",Heavy rain,,,,,,,21280.0,Km2,2.83,37.67,,,2008,3.0,20.0,2008,4.0,2.0,2.0,,10000.0,,10000.0,,,,,,,79.4563043953641,2,,51352;51374,"Marsabit, Rachuonyo (Adm2)."
2008-0260-KEN,2008,260,FL-2008-000092,Natural,Hydrological,Flood,Riverine flood,,,Kenya,KEN,Eastern Africa,Africa,"Tana river delta area (Tana River district, Coast province)",,,,,,,,41800.0,Km2,-1.57,40.12,,,2008,6.0,13.0,2008,6.0,20.0,16.0,,8658.0,,8658.0,,,,,,,79.4563043953641,2,,51346,Tana River (Adm2).
2008-0483-KEN,2008,483,,Natural,Hydrological,Flood,Riverine flood,,,Kenya,KEN,Eastern Africa,Africa,"Katilu area (Turkana district, Rift Valley province)",Hevay rains,,,,,,,,Km2,,,,Turkwel river,2008,10.0,4.0,2008,10.0,7.0,17.0,,6310.0,,6310.0,,,,,,,79.4563043953641,2,,51392,Turkana (Adm2).
2008-0482-KEN,2008,482,,Natural,Hydrological,Flood,Flash flood,,,Kenya,KEN,Eastern Africa,Africa,Mandera district (North Eastern province),Heavy rain,,,,,,202.0,45130.0,Km2,4.0,41.9,,Daua,2008,10.0,14.0,2008,10.0,16.0,3.0,,6000.0,,6000.0,,,,,,,79.4563043953641,2,,51363,Mandera (Adm2).
2008-0518-KEN,2008,518,FL-2008-000217,Natural,Hydrological,Flood,Riverine flood,,,Kenya,KEN,Eastern Africa,Africa,"Busia district (Western province), Mandera, Garissa, Wajir districts (North Western province), Marakwet, Trans Nzoia districts (Rift Valley province), Tana River district (Coast province), Migori, Nyando districts (Nyanza province)",Heavy rains,"Slide (land, mud, snow, rock)",,,,,,37960.0,Km2,0.05,35.12,,Nzoia river,2008,11.0,10.0,2008,11.0,25.0,17.0,,30770.0,,30770.0,,,,,,,79.4563043953641,2,,51346;51361;51363;51364;51385;51391;51396,"Busia, Garissa, Mandera, Marakwet, Tana River, Trans Nzoia, Wajir (Adm2)."
2009-0494-KEN,2009,494,,Natural,Hydrological,Flood,Riverine flood,,,Kenya,KEN,Eastern Africa,Africa,"Mandera district (North Eastern province), Malindi, Tana River districts (Coast province), Nyanza, Western provinces","El Nino, exceptional heavy rains","Slide (land, mud, snow, rock)",,,,,,,Km2,,,,Tana River,2009,10.0,29.0,2009,11.0,4.0,16.0,,44850.0,,44850.0,,,,,,,79.1738027553029,1;2,51330;51332,51343;51346;51363,"Nyanza, Western (Adm1). Malindi, Mandera, Tana River (Adm2)."
2009-0597-KEN,2009,597,FL-2010-000003,Natural,Hydrological,Flood,Riverine flood,,,Kenya,KEN,Eastern Africa,Africa,"Nairobi district (Nairobi province), Turkana, Laikipia, Kajiado, Koibatek, Baringo, Narok, West Pokot, Kericho, Keiyo, Marakwet, Samburu, Nakuru districts (Rift Valley province), Kilifi, Tana River, Taita Taveta districts (Coast province), Nyando district (Nyanza province), Kiambu district (Central province), Isiolo, Makueni districts (Eastern province), Homa Bay district (Nyanza province)",Heavy rain,"Slide (land, mud, snow, rock)",,,,,,,Km2,,,,,2009,12.0,24.0,2010,1.0,12.0,40.0,,91350.0,,91350.0,,,,,,,79.1738027553029,2,,51333;51340;51345;51346;51348;51351;51360;51368;51373;51377;51380;51381;51382;51383;51384;51385;51386;51388;51389;51392;51394,"Baringo, Homa Bay, Isiolo, Kajiado, Keiyo, Kericho, Kiambu, Kilifi, Koibatek, Laikipia, Makueni, Marakwet, Nairobi, Nakuru, Narok, Nyando, Samburu, Taita Taveta, Tana River, Turkana, West Pokot (Adm2)."
2010-0094-KEN,2010,94,,Natural,Hydrological,Flood,Riverine flood,,,Kenya,KEN,Eastern Africa,Africa,"Mandera district (North Eastern province), Turkana, Marakwet, Samburu, Nandi North, Nandi South, Nakuru, Baringo, Narok districts (Rift Valley province), Isiolo, Makueni, Marsabit, Moyale districts (Eastern province), Malindi, Tana River districts (Coast province), Maragua district (Central province), Nairobi district (Nairobi province)","Heavy rains, Long Rains Season (March-June)","Slide (land, mud, snow, rock)",Lightening,,,,,40320.0,Km2,0.01,34.5,,,2010,3.0,1.0,2010,5.0,14.0,94.0,,141164.0,,141164.0,,,,,,,80.472285151979,2,,51335;51343;51346;51348;51351;51352;51357;51360;51363;51377;51385;51386;51388;51389;51392;68769;68770,"Baringo, Isiolo, Makueni, Malindi, Mandera, Maragua, Marakwet, Marsabit, Moyale, Nairobi, Nakuru, Nandi North, Nandi South, Narok, Samburu, Tana River, Turkana (Adm2)."
2010-0285-KEN,2010,285,,Natural,Hydrological,Flood,Riverine flood,,,Kenya,KEN,Eastern Africa,Africa,"Salabani village (Marigat area, Baringo district, Rift Valley province), Western province",,,,,,,,196100.0,Km2,1.5,36.0,,,2010,5.0,8.0,2010,5.0,24.0,100.0,,70000.0,,70000.0,,,,,,,80.472285151979,1;2,51332,51377,Western (Adm1). Baringo (Adm2).
2011-0423-KEN,2011,423,,Natural,Hydrological,Flood,Riverine flood,,,Kenya,KEN,Eastern Africa,Africa,"Kisumu town (Kisimu district, Nyanza province), Turkana district (Rift Valley province)",Heavy rains,,,,,,,20554.0,Km2,0.1257,35.57,,,2011,8.0,15.0,2011,9.0,8.0,8.0,,4000.0,,4000.0,,,,,,,83.0126743931774,2,,51369;51392,"Kisumu, Turkana (Adm2)."
2011-0476-KEN,2011,476,,Natural,Hydrological,Flood,Riverine flood,,,Kenya,KEN,Eastern Africa,Africa,"Dadaab village (Garissa district, North Eastern province)",Heavy rains,,,,,,,,Km2,,,,,2011,11.0,4.0,2011,11.0,4.0,,,,5000.0,5000.0,,,,,,,83.0126743931774,2,,51361,Garissa (Adm2).
2011-0504-KEN,2011,504,FL-2011-000184,Natural,Hydrological,Flood,Riverine flood,,,Kenya,KEN,Eastern Africa,Africa,"Busia, Kakamega districts (Western province), Siaya, Kisumu, Rachuonyo, Central Kisii districts (Nyanza province), Tana River district (Coast province), Baringo, Keiyo, West Pokot, Samburu, Marakwet districts (Rift Valley province), Moyale, Marsabit, Isiolo districts (Eastern province), Wajir district (North Eastern province), Muranga district (Central province)",Heavy raisn and storms,,,,,,,9789.0,Km2,0.385,36.12,,,2011,11.0,29.0,2011,12.0,22.0,25.0,,91692.0,,91692.0,,,,,,,83.0126743931774,2,,51336;51346;51348;51352;51357;51364;51366;51369;51374;51375;51377;51381;51385;51389;51394;51396;51398,"Baringo, Busia, Central Kisii, Isiolo, Kakamega, Keiyo, Kisumu, Marakwet, Marsabit, Moyale, Muranga, Rachuonyo, Samburu, Siaya, Tana River, Wajir, West Pokot (Adm2)."
2012-0166-KEN,2012,166,,Natural,Hydrological,Flood,Riverine flood,,,Kenya,KEN,Eastern Africa,Africa,"Kitengela, Athi River areas (Machakos district, Eastern province), Ngong town (Kajiado district, Rift Valley province), Bura, Garsen, Bangale areas (Tana River district, Coast province), Homa Bay, Kisumu, Suba, Nyando, Rachuonyo, Migori districts (Nyanza province), Busia district (Western province), Thika district (Central province), Nakuru district (Rift Valley province), Malindi district (Coast province)",Torrential rain,,,,,,,12660.0,Km2,-0.191962,35.19,,,2012,4.0,20.0,2012,5.0,16.0,73.0,,280670.0,,280670.0,,,1000.0,1180.0,100000.0,118021.0,84.7304788978789,2,,51339;51343;51346;51350;51368;51369;51371;51373;51374;51376;51380;51386;51396,"Busia, Homa Bay, Kajiado, Kisumu, Machakos, Malindi, Migori, Nakuru, Nyando, Rachuonyo, Suba, Tana River, Thika (Adm2)."
2013-0305-KEN,2013,305,FL-2013-000004,Natural,Hydrological,Flood,Riverine flood,,,Kenya,KEN,Eastern Africa,Africa,"Nairobi district (Nairobi province), Baringo, Keiyo, Marakwet, Nandi North, Nandi South, Trans Nzoia, Turkana, Uasin Gishu, West Pokot districts (Rift Valley province), Nyando, Kisumu districts (Nyanza province)",Heavy rains,,,,,,,71113.0,Km2,0.058024,36.52,,,2013,1.0,13.0,2013,1.0,17.0,18.0,,10780.0,,10780.0,,,,,,,85.9716422479773,2,,51360;51369;51373;51377;51381;51385;51391;51392;51393;51394;68769;68770,"Baringo, Keiyo, Kisumu, Marakwet, Nairobi, Nandi North, Nandi South, Nyando, Trans Nzoia, Turkana, Uasin Gishu, West Pokot (Adm2)."
2013-0123-KEN,2013,123,FL-2013-000038,Natural,Hydrological,Flood,Riverine flood,,,Kenya,KEN,Eastern Africa,Africa,"Naivasha town (Nakuru district, Rift Valley province), Turkana, West Pokot, Baringo, Marakwet, Keiyo districts (Rift Valley province), Kisumu district (Nyanza province), Muranga, Nyeri, Kiambu districts (Central province), Coast, Western provinces",Heavy rains,"Slide (land, mud, snow, rock)",,,,,,73170.0,Km2,2.46174,36.72,,Nzoia river,2013,3.0,10.0,2013,4.0,30.0,96.0,20.0,100000.0,,100020.0,,,,,36000.0,41874.0,85.9716422479773,1;2,51326;51332,51333;51336;51338;51369;51377;51381;51385;51386;51392;51394,"Coast, Western (Adm1). Baringo, Keiyo, Kiambu, Kisumu, Marakwet, Muranga, Nakuru, Nyeri, Turkana, West Pokot (Adm2)."
2013-0281-KEN,2013,281,,Natural,Hydrological,Flood,Riverine flood,,,Kenya,KEN,Eastern Africa,Africa,"Marigat, Ngambo, Salabani villages (Baringo district, Rift Valley province)",Heavy rains,,,,,,,9047.0,Km2,1.66076,35.21,,Braingo lake,2013,8.0,5.0,2013,8.0,7.0,,,5000.0,,5000.0,,,,,,,85.9716422479773,2,,51377,Baringo (Adm2).
2015-0158-KEN,2015,158,,Natural,Hydrological,Flood,Flash flood,,,Kenya,KEN,Eastern Africa,Africa,Homa Bay district (Nyanza province),Torrential rain,,,,,,,,Km2,,,,,2015,4.0,4.0,2015,4.0,10.0,13.0,,1500.0,,1500.0,,,,,,,87.4699322108025,2,,51368,Homa Bay (Adm2).
2015-0159-KEN,2015,159,FL-2015-000049,Natural,Hydrological,Flood,Riverine flood,,,Kenya,KEN,Eastern Africa,Africa,"Narok district (Rift Valley province), Kisumu, Central Kisii, Homa Bay districts (Nyanza province), Nairobi district (Nairobi province)",Heavy rains,,,,,,,20432.0,Km2,-0.795,36.25,,,2015,4.0,27.0,2015,5.0,2.0,13.0,,3000.0,,3000.0,,,,,,,87.4699322108025,2,,51360;51366;51368;51369;51388,"Central Kisii, Homa Bay, Kisumu, Nairobi, Narok (Adm2)."
2015-0564-KEN,2015,564,FL-2015-000169,Natural,Hydrological,Flood,Riverine flood,,,Kenya,KEN,Eastern Africa,Africa,"Mt Elgon, Busia, Bungoma districts (Western province), Kirinyaga district (Central province), Kisumu district (Nyanza province), Tana River district (Coast province), Marsabit, Isiolo, Machakos districts (Eastern province), Mandera, Wajir districts (North Eastern province), Narok, Nandi North, Nandi South, Trans Nzoia districts (Rift Valley province)",Heavy rains,,,,,,,103770.0,Km2,-2.036,39.513,,"Garissa, Tana, Nyando, Kilifi, Nzoia rivers",2015,12.0,1.0,2016,1.0,6.0,112.0,73.0,240726.0,,240799.0,,,,,,,87.4699322108025,2,,51334;51346;51348;51350;51352;51363;51364;51369;51388;51391;51395;51396;51400;68769;68770,"Bungoma, Busia, Isiolo, Kirinyaga, Kisumu, Machakos, Mandera, Marsabit, Mt Elgon, Nandi North, Nandi South, Narok, Tana River, Trans Nzoia, Wajir (Adm2)."
2016-0089-KEN,2016,89,,Natural,Hydrological,Flood,Riverine flood,,,Kenya,KEN,Eastern Africa,Africa,"Lodwar city, Napetet, Soweto, Kalifonia, Nakerekei villages (Turkana district, Rift Valley province)",Heavy rains,,,,,,,,Km2,,,,"Turkwel, Kawalase rivers",2016,3.0,10.0,2016,3.0,10.0,3.0,,,1000.0,1000.0,,,,,,,88.573452875574,2,,51392,Turkana (Adm2).
2016-0161-KEN,2016,161,,Natural,Hydrological,Flood,,,,Kenya,KEN,Eastern Africa,Africa,"Nairobi district (Nairobi province); Turkana, Wajir, Marsabit",,Collapse,,,,,,,Km2,,,,"Kolotum, Mutoine, Garissa, Tana rivers",2016,4.0,29.0,2016,5.0,2.0,39.0,,10000.0,,10000.0,,,,,,,88.573452875574,2,,51352;51360;51364;51392,"Marsabit, Nairobi, Turkana, Wajir (Adm2)."
2017-0205-KEN,2017,205,,Natural,Hydrological,Flood,Riverine flood,,,Kenya,KEN,Eastern Africa,Africa,"Coastal, Central, Northeastern, Western regions; Mombasa, Kwale, Taveta, Dadaab camp",Heavy rainfall,,,,,,,55028.0,Km2,-2.879,37.88,,,2017,5.0,8.0,2017,5.0,16.0,26.0,,25000.0,,25000.0,194000.0,214459.0,,,,,90.4601793133611,1,51325;51326;51329;51332,,"Central, Coast, North Eastern, Western (Adm1)."
2018-0116-KEN,2018,116,,Natural,Hydrological,Flood,,,,Kenya,KEN,Eastern Africa,Africa,Nairobi,Heavy rains,,,,,,,,Km2,,,,"Ngong, Athi rivers",2018,3.0,14.0,2018,3.0,20.0,15.0,,,,,,,,,,,92.6696698010059,1,51328,,Nairobi (Adm1).
2018-0132-KEN,2018,132,,Natural,Hydrological,Flood,,,,Kenya,KEN,Eastern Africa,Africa,"Tana river, Garissa, Kisumu, Mandera, Samburu, Tarkana, Isiolo, WAjir",Heavy rains,,,,,,,,Km2,,,,,2018,3.0,14.0,2018,5.0,31.0,72.0,33.0,211155.0,,211188.0,,,,,350000.0,377686.0,92.6696698010059,2,,51346;51348;51361;51363;51364;51369;51389;51392,"Garissa, Isiolo, Kisumu, Mandera, Samburu, Tana River, Turkana, Wajir (Adm2)."
2018-0148-KEN,2018,148,,Natural,Hydrological,Flood,,,,Kenya,KEN,Eastern Africa,Africa,"Near Nakuru, Rongai region",,Broken Dam/Burst bank,,,,,,,Km2,,,,,2018,5.0,9.0,2018,5.0,10.0,47.0,,,,,,,,,,,92.6696698010059,2,,51386,Nakuru (Adm2).
2019-0500-KEN,2019,500,FL-2019-000138,Natural,Hydrological,Flood,Flash flood,,,Kenya,KEN,Eastern Africa,Africa,"Mombasa, Kwale, Kilifi, Tana River, Taita–Taveta, Garissa, Wajir, Mandera, Marsabit, Isiolo, Meru, Kitui, Machakos, Makueni, Kirinyaga, Murang'a, Turkana, West Pokot, Samburu, Trans-Nzoia, Elgeyo-Marakwet, Nandi, Narok, Kajiado, Kakamega, Bungoma, Siaya, Kisumu, Homa Bay counties",,"Slide (land, mud, snow, rock)",,,,,,232028.0,Km2,0.728,39.414,,,2019,10.0,10.0,2019,12.0,13.0,90.0,,233339.0,,233339.0,,,,,,,94.3490924994534,2,,51364;51385;51392,"Marakwet, Turkana, Wajir (Adm2)."
2020-0164-KEN,2020,164,,Natural,Hydrological,Flood,,,,Kenya,KEN,Eastern Africa,Africa,"West Pokot, Elgeyo Marakwet, Kisumu, Homabay, Tana River, Garissa, Kilifi, Kirinyaga, Siaya, Kakamega, Bomet, Nairobi counties",Heavy rains,"Slide (land, mud, snow, rock)",,,,,,154390.0,Km2,1.163,36.593,,,2020,4.0,18.0,2020,6.0,1.0,285.0,,810655.0,,810655.0,,,,,10000.0,10470.0,95.5129674174503,2,,51334;51340;51346;51360;51361;51368;51369;51375;51378;51385;51394;51398,"Bomet, Garissa, Homa Bay, Kakamega, Kilifi, Kirinyaga, Kisumu, Marakwet, Nairobi, Siaya, Tana River, West Pokot (Adm2)."
2021-0227-KEN,2021,227,FL-2021-000038,Natural,Hydrological,Flood,,,,Kenya,KEN,Eastern Africa,Africa,"Tana River, Busia, Kisumu, Garissa, Marsabit, Homa Bay, Migori, Narok, Siaya, Nairobi, Elgeyo-Marakwet, Siaya, Baringo, Taita Taveta, Nakuru Counties","""Long Rains"" season",,,,,,,,Km2,,,,"Endau, River Kipsangui, Tana rivers",2021,4.0,7.0,2021,5.0,30.0,9.0,,300000.0,,300000.0,,,,,,,100.0,1;2,51328,51345;51346;51352;51361;51368;51369;51371;51375;51377;51381;51385;51386;51388;51396,"Nairobi (Adm1). Baringo, Busia, Garissa, Homa Bay, Keiyo, Kisumu, Marakwet, Marsabit, Migori, Nakuru, Narok, Siaya, Taita Taveta, Tana River (Adm2)."
