Dis No,Year,Seq,Glide,Disaster Group,Disaster Subgroup,Disaster Type,Disaster Subtype,Disaster Subsubtype,Event Name,Country,ISO,Region,Continent,Location,Origin,Associated Dis,Associated Dis2,OFDA Response,Appeal,Declaration,AID Contribution ('000 US$),Dis Mag Value,Dis Mag Scale,Latitude,Longitude,Local Time,River Basin,Start Year,Start Month,Start Day,End Year,End Month,End Day,Total Deaths,No Injured,No Affected,No Homeless,Total Affected,Reconstruction Costs ('000 US$),"Reconstruction Costs, Adjusted ('000 US$)",Insured Damages ('000 US$),"Insured Damages, Adjusted ('000 US$)",Total Damages ('000 US$),"Total Damages, Adjusted ('000 US$)",CPI,Adm Level,Admin1 Code,Admin2 Code,Geo Locations
1909-0022-PAK,1909,22,,Natural,Geophysical,Earthquake,Ground movement,,,Pakistan,PAK,Southern Asia,Asia,,,,,,,,,7.0,Richter,30.0,68.0,05:11,,1909,10.0,21.0,1909,10.0,21.0,231.0,,,,,,,,,,,3.3232581812022,,,,
1935-0005-PAK,1935,5,,Natural,Geophysical,Earthquake,Ground movement,,,Pakistan,PAK,Southern Asia,Asia,Quetta (Baluchistan),,Tsunami/Tidal wave,,,,,,8.0,Richter,29.5,66.8,03.02,,1935,5.0,31.0,1935,5.0,31.0,60000.0,25000.0,,,25000.0,,,,,,,5.0710458172419,,,,
1945-0007-PAK,1945,7,,Natural,Geophysical,Earthquake,Ground movement,,,Pakistan,PAK,Southern Asia,Asia,Makran,,Tsunami/Tidal wave,,,,,,8.0,Richter,24.927,63.601,03:26,,1945,11.0,28.0,1945,11.0,28.0,4000.0,,,,,,,,,25000.0,375442.0,6.6588247260385,,,,
1955-0055-PAK,1955,55,,Natural,Geophysical,Earthquake,Ground movement,,,Pakistan,PAK,Southern Asia,Asia,Quetta,,,,,,,,,Richter,30.5,67.0,03:48,,1955,2.0,19.0,1955,2.0,19.0,12.0,,,,,,,,,,,9.8811808440849,,,,
1972-0132-PAK,1972,132,,Natural,Geophysical,Earthquake,Ground movement,,,Pakistan,PAK,Southern Asia,Asia,"Tangir, Gupis, Rawalpindi, Peshawar",,,,,,,,6.0,Richter,36,73.4,21:48,,1972,9.0,3.0,1972,9.0,3.0,100.0,,5000.0,,5000.0,,,,,,,15.4322326700197,,,,
1974-0063-PAK,1974,63,,Natural,Geophysical,Earthquake,Ground movement,,,Pakistan,PAK,Southern Asia,Asia,"North Indus R. Valley, Balakot, Patan",,Tsunami/Tidal wave,,Yes,,,,6.0,Richter,35.1,72.9,17:28,,1974,12.0,28.0,1974,12.0,28.0,4700.0,15000.0,30000.0,5200.0,50200.0,,,,,3255.0,17888.0,18.196991034332,,,,
1981-0081-PAK,1981,81,,Natural,Geophysical,Earthquake,Ground movement,,,Pakistan,PAK,Southern Asia,Asia,"Karakoram, Darel, Tangir, Khanbari valleys",,"Slide (land, mud, snow, rock)",,,,,,6.0,Richter,35.693,73.594,12:15,,1981,9.0,12.0,1981,9.0,12.0,250.0,2000.0,,,2000.0,,,,,5000.0,14901.0,33.5554165755522,,,,
1981-0127-PAK,1981,127,,Natural,Geophysical,Earthquake,Ground movement,,,Pakistan,PAK,Southern Asia,Asia,Koshkak,,,,,,,,4.0,Richter,29.856,66.962,01:26,,1981,12.0,12.0,1981,12.0,12.0,6.0,12.0,225.0,,237.0,,,,,,,33.5554165755522,,,,
1984-0339-PAK,1984,339,,Natural,Geophysical,Earthquake,Ground movement,,,Pakistan,PAK,Southern Asia,Asia,Chiltral-Landi Kotal (Hindu Kush),,,,,No,No,,7.0,Richter,34.07 N,71.15 E,,,1984,2.0,17.0,1984,2.0,17.0,4.0,12.0,,,12.0,,,,,,,38.3376251913405,,,,
1985-0078-PAK,1985,78,,Natural,Geophysical,Earthquake,Ground movement,,,Pakistan,PAK,Southern Asia,Asia,"Chitral, Swat districts",,,,,,,,7.0,Richter,36.19,70.896,12:54,,1985,7.0,29.0,1985,7.0,29.0,5.0,38.0,12000.0,,12038.0,,,,,2000.0,5038.0,39.696934178876,,,,
1986-0186-PAK,1986,186,,Natural,Geophysical,Earthquake,Ground movement,,,Pakistan,PAK,Southern Asia,Asia,Khuzdar area,,,,,No,No,,5.0,Richter,27.727 N,66.650 E,,,1986,10.0,16.0,1986,10.0,16.0,,,750.0,,750.0,,,,,,,40.4504089219331,,,,
1990-0189-PAK,1990,189,,Natural,Geophysical,Earthquake,Ground movement,,,Pakistan,PAK,Southern Asia,Asia,Kalat Area,,,,,No,No,,6.0,Richter,28.925 N,66.331 E,,,1990,3.0,4.0,1990,3.0,4.0,11.0,40.0,,,40.0,,,,,1000.0,2074.0,48.2187972884321,,,,
1990-0165-PAK,1990,165,,Natural,Geophysical,Earthquake,Ground movement,,,Pakistan,PAK,Southern Asia,Asia,Hindu Kush region,,,,,No,No,,7.0,Richter,35.121 N,70.486 E,,,1990,10.0,22.0,1990,10.0,22.0,11.0,250.0,,,250.0,,,,,,,48.2187972884321,,,,
1991-0033-PAK,1991,33,,Natural,Geophysical,Earthquake,Ground movement,,,Pakistan,PAK,Southern Asia,Asia,"Malakand, Chitral, Peshawar area",,,,,,,,6.0,Richter,38.993,70.423,,,1991,1.0,31.0,1991,1.0,31.0,300.0,574.0,174755.0,29465.0,204794.0,,,,,10000.0,19896.0,50.2608528318391,,,,
1992-0202-PAK,1992,202,,Natural,Geophysical,Earthquake,Ground movement,,,Pakistan,PAK,Southern Asia,Asia,"Peshawar, Kohat districts",,,,,No,No,,6.0,Richter,33.377 N,71.317 E,,,1992,5.0,20.0,1992,5.0,20.0,36.0,100.0,,2000.0,2100.0,,,,,,,51.7831620380495,,,,
1992-0058-PAK,1992,58,,Natural,Geophysical,Earthquake,Ground movement,,,Pakistan,PAK,Southern Asia,Asia,Quetta,,,,,No,No,,6.0,Richter,29.3 N,66.7 E,5:51,,1992,8.0,28.0,1992,8.0,28.0,4.0,,200.0,,200.0,,,,,,,51.7831620380495,,,,
1997-0030-PAK,1997,30,,Natural,Geophysical,Earthquake,Ground movement,,,Pakistan,PAK,Southern Asia,Asia,"Harnai (Sibi district, Baluchistan Province)",,"Slide (land, mud, snow, rock)",,,No,Yes,,6.0,Richter,29.976 N,68.208 E,02:08,,1997,2.0,28.0,1997,2.0,28.0,50.0,100.0,,10000.0,10100.0,,,,,,,59.2378657336541,,,,
1998-0579-PAK,1998,579,,Natural,Geophysical,Earthquake,Ground movement,,,Pakistan,PAK,Southern Asia,Asia,"Yar Husain, Rawalpindi, Peshawar",,"Slide (land, mud, snow, rock)",,,,,,6.0,Richter,36.479,71.086,17:18,,1998,2.0,20.0,1998,2.0,20.0,1.0,11.0,,600.0,611.0,,,,,,,60.1574108900066,,,,
2001-0033-PAK,2001,33,,Natural,Geophysical,Earthquake,Ground movement,,,Pakistan,PAK,Southern Asia,Asia,"Badin District, Tharparkar District, Mirpur Khas District districts (Sindh province)",,,,Yes,,,215.0,8.0,Richter,23.419,70.232,,,2001,1.0,26.0,2001,1.0,26.0,12.0,100.0,914192.0,,914292.0,,,,,500.0,765.0,65.345558714192,2,,23681;40399;40405,"Badin District, Mirpur Khas District, Tharparkar District (Adm2)."
2002-0122-PAK,2002,122,,Natural,Geophysical,Earthquake,Ground movement,,,Pakistan,PAK,Southern Asia,Asia,Bajaur Agency district (Federally Administered Tribal Areas province),,,,,,,,6.0,Richter,36.429,70.438,,,2002,3.0,3.0,2002,3.0,3.0,3.0,,,,,,,,,,,66.3819636999782,2,,23631,Bajaur Agency (Adm2).
2002-0692-PAK,2002,692,,Natural,Geophysical,Earthquake,Ground movement,,,Pakistan,PAK,Southern Asia,Asia,Administrative unit not available district (Jammu and Kashmir province),,"Slide (land, mud, snow, rock)",,,,,,5.0,Richter,35.517,74.654,6:33,,2002,11.0,2.0,2002,11.0,2.0,17.0,65.0,11000.0,4000.0,15065.0,,,,,,,66.3819636999782,2,,40418,Administrative unit not available (Adm2).
2002-0721-PAK,2002,721,,Natural,Geophysical,Earthquake,Ground movement,,,Pakistan,PAK,Southern Asia,Asia,Administrative unit not available district (Jammu and Kashmir province),,"Slide (land, mud, snow, rock)",,,,,304.0,6.0,Richter,35.414,74.515,2:30,,2002,11.0,20.0,2002,11.0,20.0,19.0,40.0,140742.0,,140782.0,,,,,,,66.3819636999782,2,,40418,Administrative unit not available (Adm2).
2004-0054-PAK,2004,54,,Natural,Geophysical,Earthquake,Ground movement,,,Pakistan,PAK,Southern Asia,Asia,"Bisham Tehsil area (Shangla District district, North-West Frontier province), Batagram District, Mansehra District, Kohistan District districts (North-West Frontier province)",,"Slide (land, mud, snow, rock)",,Yes,,,90.0,6.0,Richter,34.774,73.216,15:30,,2004,2.0,14.0,2004,2.0,14.0,24.0,63.0,10765.0,2320.0,13148.0,,,,,,,69.7064421605073,2,,40331;40340;40344;40348,"Batagram District, Kohistan District, Mansehra District, Shangla District (Adm2)."
2005-0575-PAK,2005,575,,Natural,Geophysical,Earthquake,Ground movement,,,Pakistan,PAK,Southern Asia,Asia,"Bisham Tehsil, Chakisar Tehsil areas (Shangla District district, North-West Frontier province), Palas Sub-Division area (Kohistan District district, North-West Frontier province), Abbottabad District, Mansehra District, Batagram District districts (North-West Frontier province), Gujranwala District, Gujrat District, Rawalpindi District districts (Punjab province), Islamabad District district (Islamabad province),",,,,Yes,,,,8.0,Richter,34.539,73.588,08:50,,2005,10.0,8.0,2005,10.0,8.0,73338.0,128309.0,,5000000.0,5128309.0,5200000.0,7215066.0,,,5200000.0,7215066.0,72.0714104526569,2,,23638;23674;40329;40331;40340;40344;40348;40360;40361,"Abbottabad District, Batagram District, Gujranwala District, Gujrat District, Islamabad District, Kohistan District, Mansehra District, Rawalpindi District, Shangla District (Adm2)."
2008-0500-PAK,2008,500,EQ-2008-000206,Natural,Geophysical,Earthquake,Ground movement,,,Pakistan,PAK,Southern Asia,Asia,"Khanozai village (Pishin District district, Balochistan province), Kawas village (Ziarat District district, Balochistan province), Harnai area (Sibi District district, Balochistan province)",,"Slide (land, mud, snow, rock)",,Yes,,,15792.0,6.0,Richter,30.639,67.351,04:09,,2008,10.0,28.0,2008,10.0,28.0,166.0,320.0,75000.0,,75320.0,,,,,10000.0,12586.0,79.4563043953641,2,,40310;40312;40314,"Pishin District, Sibi District, Ziarat District (Adm2)."
2011-0104-PAK,2011,104,,Natural,Geophysical,Earthquake,Ground movement,,,Pakistan,PAK,Southern Asia,Asia,"Garhi Khairo village (Jacobabad district, Sindh province), Quetta, Chagai districts (Balochistan province)",,,,,,,,7.0,Richter,28.777,63.951,,,2011,1.0,18.0,2011,1.0,18.0,2.0,,1000.0,,1000.0,,,,,,,83.0126743931774,2,,23614;23627;23684,"Chagai District, Jacobabad District, Quetta District (Adm2)."
2013-0099-PAK,2013,99,,Natural,Geophysical,Earthquake,Ground movement,,,Pakistan,PAK,Southern Asia,Asia,"Mashkhel area (Chagai district, Balochistan province), Washuk area (Kharan district, Balochistan province), Karachi Central District, Karachi East District, Karachi South District, Karachi West District districts (Sindh province)",,,,,,,,8.0,Richter,28.033,61.996,,,2013,4.0,16.0,2013,4.0,16.0,41.0,175.0,15000.0,,15175.0,,,,,,,85.9716422479773,2,,23614;23619;40392;40393;40394;40395,"Chagai District, Karachi Central District, Karachi East District, Karachi South District, Karachi West District, Kharan District (Adm2)."
2013-0381-PAK,2013,381,,Natural,Geophysical,Earthquake,Ground movement,,,Pakistan,PAK,Southern Asia,Asia,"Awaran District, Chagai District, Gwadar District, Kech District, Khuzdar District, Panjgur District districts (Balochistan province)",,,,,,,,8.0,Richter,26.951,65.5009,16:29,,2013,9.0,24.0,2013,9.0,24.0,399.0,599.0,185150.0,,185749.0,,,,,100000.0,116317.0,85.9716422479773,2,,23614;23616;23625;40289;40298;40300,"Awaran District, Chagai District, Gwadar District, Kech District, Khuzdar District, Panjgur District (Adm2)."
2013-0484-PAK,2013,484,,Natural,Geophysical,Earthquake,Ground movement,,,Pakistan,PAK,Southern Asia,Asia,Awaran District district (Balochistan province),,,,,,,,7.0,Richter,27.1825,65.5052,12:34,,2013,9.0,28.0,2013,9.0,28.0,22.0,50.0,,,50.0,,,,,,,85.9716422479773,2,,40289,Awaran District (Adm2).
2015-0476-PAK,2015,476,EQ-2015-000147,Natural,Geophysical,Earthquake,Ground movement,,,Pakistan,PAK,Southern Asia,Asia,"Islamabad District district (Islamabad province), Chakwal District, Gujranwala District, Jhang District, Jhelum District, Kasur District, Mianwali District, Multan District, Muzaffargarh District, Narowal District, Rawalpindi District, Sahiwal District, Sargodha District, Sheikhupura District districts (Punjab province), Azad area (Jammu and Kashmir province), North-West Frontier province",,,,,,,,8.0,Richter,36.5244,70.3676,14:09,,2015,10.0,25.0,2015,10.0,25.0,280.0,1745.0,366945.0,133900.0,502590.0,,,,,,,87.4699322108025,1;2,2275;40408,23638;23656;23661;23662;23663;23668;23670;23674;23676;23677;40360;40373;40375;40381,"Jammu and Kashmir (Administrative unit not available), North-West Frontier (Adm1). Chakwal District, Gujranwala District, Islamabad District, Jhang District, Jhelum District, Kasur District, Mianwali District, Multan District, Muzaffargarh District, Narowal District, Rawalpindi District, Sahiwal District, Sargodha District, Sheikhupura District (Adm2)."
2015-0571-PAK,2015,571,,Natural,Geophysical,Earthquake,Ground movement,,,Pakistan,PAK,Southern Asia,Asia,Khyber Agency district (Federally Administrered Tribal Areas province),,,,,,,,6.0,Richter,36.4935,71.1263,,,2015,12.0,25.0,2015,12.0,25.0,3.0,85.0,,,85.0,,,,,,,87.4699322108025,2,,23632,Khyber Agency (Adm2).
2016-0100-PAK,2016,100,,Natural,Geophysical,Earthquake,Ground movement,,,Pakistan,PAK,Southern Asia,Asia,"North-West Frontier, Gilgit-Baltistan provinces, Khyber Agency district (Federally Administered Tribal Areas province)",,,,,,,,7.0,Richter,36.473,71.13,,,2016,4.0,10.0,2016,4.0,10.0,6.0,42.0,100.0,,142.0,,,,,,,88.573452875574,1;2,2275;40409,23632,"Jammu and Kashmir (Administrative unit not available), North-West Frontier (Adm1). Khyber Agency (Adm2)."
2019-0460-PAK,2019,460,EQ-2019-000117,Natural,Geophysical,Earthquake,Ground movement,,,Pakistan,PAK,Southern Asia,Asia,Mirpur district (Southern Azad Jammu and Kashmir Territory),,,,,,,,6.0,Richter,33.106,73.766,16:01,,2019,9.0,24.0,2019,9.0,24.0,39.0,746.0,129652.0,,130398.0,,,,,17000.0,18018.0,94.3490924994534,2,,40413,Administrative unit not available (Adm2).
2021-0654-PAK,2021,654,EQ-2021-000156,Natural,Geophysical,Earthquake,Ground movement,,,Pakistan,PAK,Southern Asia,Asia,Hernai district i(Balochistan),,"Slide (land, mud, snow, rock)",,,,Yes,,6.0,Richter,30.22,68.014,03:02,,2021,10.0,7.0,2021,10.0,7.0,21.0,300.0,63800.0,,64100.0,,,,,,,100.0,2,,40312,Sibi District (Adm2).
2022-0342-PAK,2022,342,,Natural,Geophysical,Earthquake,Ground movement,,,Pakistan,PAK,Southern Asia,Asia,Lakki Marwat District (southern Khyber Pakhtunkhwa),,,,,,,,6.0,Richter,,,,,2022,6.0,21.0,2022,6.0,21.0,43.0,,,,,,,,,,,,2,,23632,Khyber Agency (Adm2).
