2018-0008-MDG,2018,8,TC-2018-000001,Natural,Meteorological,Storm,Tropical cyclone,,Cyclone 'Ava',Madagascar,MDG,Eastern Africa,Africa,"Antananarivo Atsimondrano, Antananarivo Avaradrano, Antananarivo Renivohitra (Analamanga); Fenerive Eet, Manama, Maroantsetra, Sainte Marie, Soanierana Ivongo (Analanjirofo), Befotaka, Faraganga, Vaingaindrano (Astimo Atsinanana); Antanamabo Manampotsy, Brickaville, Mahanoro, Toasmasina I et II, Vatomandry (Atsinanana); Mahanja (Boeny); Miandrivazo (Menabe); Ambohimahaso (Haute Matsiatra); Antalaha, Sambava, Andapa, Vohemar (SAVA); Mampikony (Sofia); Ifanadiana, Manakara, Mananjary, Nosy Varika, Vohipeno (Vatovavy Fitovanmay)",,Flood,"Slide (land, mud, snow, rock)",,,,,165.0,Kph,,,,,2018,1.0,5.0,2018,1.0,8.0,73.0,,161318.0,,161318.0,,,,,,,92.6696698010059,1;2,41752,154553;154554;154556;154557;154558;154614;154615,"Analamanga (Adm1). Brickaville, Mahanoro, Mananjary, Nosy-Varika, Toamasina I, Toamasina II, Vatomandry (Adm2)."
2018-0086-MDG,2018,86,,Natural,Meteorological,Storm,Tropical cyclone,,Tropical storm 'Eliakim',Madagascar,MDG,Eastern Africa,Africa,"Mandritsara, Soanierana Ivongo, Masoala, SAVA, Analanjirofo, Sofia,Alaotra Mangoro, Antsinana, Diana, Vatovavy Fitovinany regions",,Flood,,,,,,105.0,Kph,,,,,2018,3.0,14.0,2018,3.0,20.0,21.0,,50872.0,,50872.0,,,,,,,92.6696698010059,1,41750;41753;41762;41768;41769;41771,,"Alaotra Mangoro, Analanjirofo, Diana, Sava, Sofia, Vatovavy Fitovinany (Adm1)."
2019-0110-MDG,2019,110,TC-2019-000021,Natural,Meteorological,Storm,Tropical cyclone,,Cyclone 'Idai',Madagascar,MDG,Eastern Africa,Africa,Besalampy (Melaky),,,,,,,,,Kph,,,,,2019,3.0,15.0,2019,3.0,15.0,3.0,,1100.0,,1100.0,,,,,,,94.3490924994534,2,,154587,Besalampy (Adm2).
2019-0601-MDG,2019,601,TC-2019-000164,Natural,Meteorological,Storm,Tropical cyclone,,Cyclone 'Belna',Madagascar,MDG,Eastern Africa,Africa,"Mahanjanga, Soalala districts (Boeny); Diego I district (Diana); Besalampy district (Melaky); Morondava district (Menabe",,Broken Dam/Burst bank,Flood,,,,,180.0,Kph,,,,,2019,12.0,9.0,2019,12.0,10.0,5.0,6293.0,14000.0,,20293.0,,,,,25000.0,26497.0,94.3490924994534,1,41760;41762;41766,,"Boeny, Diana, Melaky (Adm1)."
2020-0103-MDG,2020,103,,Natural,Meteorological,Storm,Tropical cyclone,,Cyclone 'Herold',Madagascar,MDG,Eastern Africa,Africa,"Sava region, Maroantsetra (Analanjirofo), Antalaha (Sava)",,Flood,,,,,,148.0,Kph,-14.488,48.767,,,2020,3.0,13.0,2020,3.0,17.0,4.0,,3200.0,,3200.0,,,,,,,95.5129674174503,1;2,41768,154527,Sava (Adm1). Maroantsetra (Adm2).
2021-0036-MDG,2021,36,TC-2021-000011,Natural,Meteorological,Storm,Tropical cyclone,,Tropical cyclone 'Eloise',Madagascar,MDG,Eastern Africa,Africa,"Antalaha, Maroantsetra, Vavatenina and Toamasina districts",,,,,,,,,Kph,,,,,2021,1.0,23.0,2021,1.0,23.0,2.0,,1000.0,,1000.0,,,,,,,100.0,2,,154527;154530;154556;154557;154596,"Antalaha, Maroantsetra, Toamasina I, Toamasina II, Vavatenina (Adm2)."
2022-0052-MDG,2022,52,TC-2022-000161,Natural,Meteorological,Storm,Tropical cyclone,,Tropical storm 'Ana',Madagascar,MDG,Eastern Africa,Africa,Analamanga region,,,,,,,,,Kph,,,,,2022,1.0,22.0,2022,1.0,25.0,55.0,,131555.0,,131555.0,,,,,,,,1,41752,,Analamanga (Adm1).
2022-0061-MDG,2022,61,,Natural,Meteorological,Storm,Tropical cyclone,,Cyclone 'Batsirai',Madagascar,MDG,Eastern Africa,Africa,"Fianarantsoa and Ambositra ; Manakara Atsimo, Ikongo District (Fitovinany Region); Nosy-Varika, Mananjary (Vatovavy Region)",,Flood,,,,,,235.0,Kph,,,,,2022,2.0,5.0,2022,2.0,7.0,121.0,,143718.0,,143718.0,,,,,,,,1;2,41757,154515;154577;154612;154613;154614;154615,"Atsimo Atsinanana (Adm1). Ambositra, Fianarantsoa I, Ikongo, Manakara Atsimo, Mananjary, Nosy-Varika (Adm2)."
2022-0099-MDG,2022,99,,Natural,Meteorological,Storm,Tropical cyclone,,Tropical storm 'Dumako',Madagascar,MDG,Eastern Africa,Africa,Analanjirofo Region,,,,,,,,75.0,Kph,,,,,2022,2.0,15.0,2022,2.0,16.0,14.0,,9900.0,,9900.0,,,,,,,,1,41753,,Analanjirofo (Adm1).
2022-0101-MDG,2022,101,,Natural,Meteorological,Storm,Tropical cyclone,,Cyclone 'Emnati',Madagascar,MDG,Eastern Africa,Africa,Androka Municipality (Atsimo-Andrefana Region),,,,,,,,140.0,Kph,,,,,2022,2.0,23.0,2022,2.0,24.0,15.0,,51300.0,,51300.0,,,,,15000.0,,,1,41756,,Atsimo Andrefana (Adm1).
2022-0137-MDG,2022,137,,Natural,Meteorological,Storm,Tropical cyclone,,Tropical cyclone 'Gombe',Madagascar,MDG,Eastern Africa,Africa,"Maroantsetra (Analanjirofo Region), Antalaha Towns (Sava Region), Toamasina and Mahajanga Provinces",,,,,,,,90.0,Kph,,,,,2022,3.0,11.0,2022,3.0,12.0,2.0,,900.0,,900.0,,,,,,,,2,,154527;154556;154557;154563;154564;154596,"Antalaha, Mahajanga I, Mahajanga II, Maroantsetra, Toamasina I, Toamasina II (Adm2)."
2022-0239-MDG,2022,239,,Natural,Meteorological,Storm,Tropical cyclone,,Tropical storm 'Jasmine',Madagascar,MDG,Eastern Africa,Africa,"Toliara I, Toliara II, Morombe, Sakaraha, Betioky Atsimo, Ankazoabo, Benenitra and Ampanihy",,,,,,,,53.0,Kph,,,,,2022,4.0,26.0,2022,4.0,27.0,12.0,,4800.0,,4800.0,,,,,,,,2,,154538;154539;154540;154542;154544;154545;154546,"Ampanihy Ouest, Ankazoabo, Benenitra, Betioky Atsimo, Sakaraha, Toliary-I, Toliary-II (Adm2)."
