Dis No,Year,Seq,Glide,Disaster Group,Disaster Subgroup,Disaster Type,Disaster Subtype,Disaster Subsubtype,Event Name,Country,ISO,Region,Continent,Location,Origin,Associated Dis,Associated Dis2,OFDA Response,Appeal,Declaration,AID Contribution ('000 US$),Dis Mag Value,Dis Mag Scale,Latitude,Longitude,Local Time,River Basin,Start Year,Start Month,Start Day,End Year,End Month,End Day,Total Deaths,No Injured,No Affected,No Homeless,Total Affected,Reconstruction Costs ('000 US$),"Reconstruction Costs, Adjusted ('000 US$)",Insured Damages ('000 US$),"Insured Damages, Adjusted ('000 US$)",Total Damages ('000 US$),"Total Damages, Adjusted ('000 US$)",CPI,Adm Level,Admin1 Code,Admin2 Code,Geo Locations
1962-0010-THA,1962,10,,Natural,Meteorological,Storm,Tropical cyclone,,Harriet,Thailand,THA,South-Eastern Asia,Asia,,,,,,,,,,Kph,,,,,1962,10.0,27.0,1962,10.0,27.0,769.0,,,,,,,,,19000.0,170196.0,11.1636125082004,,,,
1981-0064-THA,1981,64,,Natural,Meteorological,Storm,Tropical cyclone,,Kelly,Thailand,THA,South-Eastern Asia,Asia,Nan province,,,,,,,,,Kph,,,,,1981,7.0,6.0,1981,7.0,6.0,,,43000.0,,43000.0,,,,,,,33.5554165755522,,,,
1989-0131-THA,1989,131,,Natural,Meteorological,Storm,Tropical cyclone,,Gay,Thailand,THA,South-Eastern Asia,Asia,"Chumphon, Nakkhon Si Thammarat, Phetchaburi, Prachuap Khiri Khan, Ranong, Songkhla, Surat Thani provinces",,,,Yes,No,No,,120.0,Kph,,,,,1989,11.0,3.0,1989,11.0,5.0,458.0,,154000.0,45000.0,199000.0,,,,,452000.0,987994.0,45.749276186311,,,,
1990-0409-THA,1990,409,,Natural,Meteorological,Storm,Tropical cyclone,,Ira,Thailand,THA,South-Eastern Asia,Asia,Central and northeastern Provinces,,,,,No,No,,,Kph,,,,,1990,10.0,8.0,1990,10.0,26.0,36.0,,,,,,,,,50000.0,103694.0,48.2187972884321,,,,
1991-0710-THA,1991,710,,Natural,Meteorological,Storm,Tropical cyclone,,,Thailand,THA,South-Eastern Asia,Asia,North and Northeast,,,,,,,,,Kph,,,,,1991,8.0,17.0,1991,8.0,17.0,38.0,20.0,1858811.0,35407.0,1894238.0,,,,,8323.0,16560.0,50.2608528318391,,,,
1992-0201-THA,1992,201,,Natural,Meteorological,Storm,,,,Thailand,THA,South-Eastern Asia,Asia,,,,,,,,,,Kph,,,,,1992,5.0,19.0,1992,5.0,19.0,,,,,,,,,,,,51.7831620380495,,,,
1992-0494-THA,1992,494,,Natural,Meteorological,Storm,Tropical cyclone,,Angela,Thailand,THA,South-Eastern Asia,Asia,Ko Samui (Surat Thani province),,,,,,,,,Kph,,,,,1992,10.0,16.0,1992,10.0,16.0,3.0,,93102.0,13007.0,106109.0,,,,,,,51.7831620380495,,,,
1992-0495-THA,1992,495,,Natural,Meteorological,Storm,Tropical cyclone,,Colleen,Thailand,THA,South-Eastern Asia,Asia,Sisaket province (North),,,,,,,,,Kph,,,,,1992,10.0,17.0,1992,10.0,17.0,,,160550.0,,160550.0,,,,,,,51.7831620380495,,,,
1992-0496-THA,1992,496,,Natural,Meteorological,Storm,,,Forrest,Thailand,THA,South-Eastern Asia,Asia,"Surat Thani, Krabi, Phangnga, Nakhon Si Thammarat provinces",,,,,,,,,Kph,,,,,1992,11.0,12.0,1992,11.0,12.0,3.0,,105674.0,14113.0,119787.0,,,,,,,51.7831620380495,,,,
1993-0481-THA,1993,481,,Natural,Meteorological,Storm,,,Lewis,Thailand,THA,South-Eastern Asia,Asia,"Nakhon Phanom, Sakon Nakhon, Nong Khai provinces",,,,,,,,,Kph,,,,,1993,7.0,11.0,1993,7.0,11.0,4.0,,188388.0,60.0,188448.0,,,,,106900.0,200519.0,53.3116203804942,,,,
1993-0482-THA,1993,482,,Natural,Meteorological,Storm,,,Winona,Thailand,THA,South-Eastern Asia,Asia,"Udon Thani, Khon Kaen, Nakhon Panom, Nan, Uttaradit, Phayao, Mae Hong Son",,,,,,,,,Kph,,,,,1993,9.0,29.0,1993,9.0,29.0,,,25468.0,,25468.0,,,,,25070.0,47025.0,53.3116203804942,,,,
1994-0120-THA,1994,120,,Natural,Meteorological,Storm,Tropical cyclone,,,Thailand,THA,South-Eastern Asia,Asia,Bangkok,,,,,,,,,Kph,,,,,1994,5.0,8.0,1994,5.0,8.0,,,5000.0,,5000.0,,,,,,,54.7016925431883,,,,
1994-0777-THA,1994,777,,Natural,Meteorological,Storm,Tropical cyclone,,Amy,Thailand,THA,South-Eastern Asia,Asia,"Lampang, Nan, Kanchanaburi, Phrae, Chinag Rai, Mae Hong Son, Tak, Phayao, Chiang Mai",,Flood,"Slide (land, mud, snow, rock)",,No,No,,,Kph,,,,,1994,7.0,28.0,1994,8.0,4.0,9.0,,10000.0,,10000.0,,,,,8000.0,14625.0,54.7016925431883,,,,
1994-0774-THA,1994,774,,Natural,Meteorological,Storm,Tropical cyclone,,Harry,Thailand,THA,South-Eastern Asia,Asia,"Chiang Rai, Chiang Mai, Phayao, Phitsanulok, Khanchanburi",,Flood,,,No,No,,,Kph,,,,,1994,8.0,30.0,1994,9.0,7.0,10.0,,,,,,,,,12000.0,21937.0,54.7016925431883,,,,
1995-0167-THA,1995,167,,Natural,Meteorological,Storm,Tropical cyclone,,,Thailand,THA,South-Eastern Asia,Asia,Bangkok,,,,,,,,,Kph,,,,,1995,8.0,9.0,1995,8.0,9.0,27.0,,,,,,,,,,,56.2363000218675,,,,
1996-0182-THA,1996,182,,Natural,Meteorological,Storm,Tropical cyclone,,Gloria and Frankie,Thailand,THA,South-Eastern Asia,Asia,"Chumphon, Chiang Rai, Nan, Nong Khai, Udon Thani, Rayong, Ranong",,Flood,,,No,No,,,Kph,,,,,1996,7.0,18.0,1996,8.0,21.0,9.0,,343386.0,,343386.0,,,,,150000.0,259136.0,57.8847058823529,,,,
1997-0184-THA,1997,184,,Natural,Meteorological,Storm,Tropical cyclone,,Zita,Thailand,THA,South-Eastern Asia,Asia,Surat Thani Province,,Flood,,,No,No,,,Kph,,,,,1997,8.0,19.0,1997,9.0,1.0,46.0,394.0,50000.0,,50394.0,,,,,39500.0,66680.0,59.2378657336541,,,,
1997-0267-THA,1997,267,,Natural,Meteorological,Storm,Tropical cyclone,,Linda,Thailand,THA,South-Eastern Asia,Asia,,,,,,No,No,,,Kph,,,,,1997,10.0,1.0,1997,10.0,4.0,152.0,,,,,,,,,5000.0,8441.0,59.2378657336541,,,,
2000-0539-THA,2000,539,,Natural,Meteorological,Storm,Tropical cyclone,,Kaemi,Thailand,THA,South-Eastern Asia,Asia,"Tha Tum, Chom Phra, Samrong Thap, Sikhoraphum, Sangkha, Muang Surin districts (Surin province), Ubon Ratchathani province",,,,,,,,,Kph,,,,,2000,8.0,21.0,2000,8.0,21.0,2.0,,41219.0,,41219.0,,,,,,,63.5495473431008,1;2,2921,27091;27095;27098;27099;27101;27102,"Ubon Ratchathani (Adm1). Chom Phra, Muang Surin, Samrong Thap, Sangkha, Sikhoraphum, Tha Tum (Adm2)."
2001-0357-THA,2001,357,,Natural,Meteorological,Storm,,,,Thailand,THA,South-Eastern Asia,Asia,"Muang Satun, Langu, Tha Phae, Khuan Don districts (Satun province)",,,,,,,,,Kph,,,,,2001,6.0,27.0,2001,6.0,27.0,,,150.0,,150.0,,,,,,,65.345558714192,2,,27008;27010;27011;27012,"Khuan Don, Langu, Muang Satun, Tha Phae (Adm2)."
2002-0069-THA,2002,69,,Natural,Meteorological,Storm,Convective storm,Hail,,Thailand,THA,South-Eastern Asia,Asia,"Muang Chang Rai, Chiang Saen, Mae Chan, Wiang Chai, Phan districts (Chiang Rai province)",,Hail,,,,,,,Kph,,,,,2002,1.0,12.0,2002,1.0,12.0,1.0,100.0,25000.0,2604.0,27704.0,,,,,2000.0,3013.0,66.3819636999782,2,,26517;26519;26523;26525;26528,"Chiang Saen, Mae Chan, Muang Chiang Rai, Phan, Wiang Chai (Adm2)."
2002-0286-THA,2002,286,,Natural,Meteorological,Storm,Convective storm,Hail,,Thailand,THA,South-Eastern Asia,Asia,"Sam Ngao, Phop Phra districts (Tak province)",,,,,,,,,Kph,,,,,2002,4.0,23.0,2002,4.0,23.0,,,2000.0,500.0,2500.0,,,,,,,66.3819636999782,2,,27107;27108,"Phop Phra, Sam Ngao (Adm2)."
2003-0235-THA,2003,235,,Natural,Meteorological,Storm,Convective storm,Hail,,Thailand,THA,South-Eastern Asia,Asia,"Muang Chiang Rai, Wiang Chai, Phan, Mae Fa Luang, Mae Suai districts (Chiang Rai province)",,,,,,,,,Kph,,,,,2003,4.0,11.0,2003,4.0,11.0,,,5000.0,,5000.0,,,,,,,67.8888956921058,2,,26520;26522;26523;26525;26528,"Mae Fa Luang, Mae Suai, Muang Chiang Rai, Phan, Wiang Chai (Adm2)."
2004-0244-THA,2004,244,,Natural,Meteorological,Storm,,,,Thailand,THA,South-Eastern Asia,Asia,Mae Ramat district (Tak province),,Flood,"Slide (land, mud, snow, rock)",,,,,,Kph,,,,,2004,5.0,20.0,2004,5.0,23.0,13.0,,5000.0,50.0,5050.0,,,,,,,69.7064421605073,2,,27104,Mae Ramat (Adm2).
2004-0258-THA,2004,258,,Natural,Meteorological,Storm,Tropical cyclone,,Chanthu (Gener/08W),Thailand,THA,South-Eastern Asia,Asia,"Phrae, Nakhon Sawan, Sukhothai, Phichit, Mae Hong Son, Tak, Nan, Phayao, Phitsanulok, Loei provinces",,Flood,Rain,,,,,,Kph,,,,,2004,6.0,4.0,2004,6.0,21.0,1.0,,4000.0,,4000.0,,,,,,,69.7064421605073,1,2870;2872;2879;2881;2891;2894;2895;2897;2914;2918,,"Loei, Mae Hong Son, Nakhon Sawan, Nan, Phayao, Phichit, Phitsanulok, Phrae, Sukhothai, Tak (Adm1)."
2005-0303-THA,2005,303,,Natural,Meteorological,Storm,,,,Thailand,THA,South-Eastern Asia,Asia,"Lampang, Nan provinces",,Hail,,,,,,,Kph,,,,,2005,5.0,21.0,2005,5.0,21.0,,,1500.0,,1500.0,,,,,246.0,341.0,72.0714104526569,1,2868;2881,,"Lampang, Nan (Adm1)."
2005-0540-THA,2005,540,,Natural,Meteorological,Storm,Tropical cyclone,,Damrey,Thailand,THA,South-Eastern Asia,Asia,"Lampang, Chiang Mai, Chiang Rai, Phayao, Mae Hong Son, Phrae, Yasothon, Ubon Ratchathani provinces",,Broken Dam/Burst bank,,,,,,,Kph,,,,"Ping, Chi",2005,9.0,26.0,2005,9.0,30.0,10.0,,2000.0,,2000.0,,,,,20000.0,27750.0,72.0714104526569,1,2859;2860;2868;2872;2891;2897;2921;2926,,"Chiang Mai, Chiang Rai, Lampang, Mae Hong Son, Phayao, Phrae, Ubon Ratchathani, Yasothon (Adm1)."
2008-0184-THA,2008,184,TC-2008-000057,Natural,Meteorological,Storm,Tropical cyclone,,Cyclone 'Nargis',Thailand,THA,South-Eastern Asia,Asia,Tak province,,Flood,,,,,,,Kph,,,,,2008,5.0,2.0,2008,5.0,3.0,,,,1000.0,1000.0,,,,,,,79.4563043953641,1,2918,,Tak (Adm1).
2008-0329-THA,2008,329,FL-2008-000128,Natural,Meteorological,Storm,Tropical cyclone,,"Tropical storm ""Kammuri"" (Julian)",Thailand,THA,South-Eastern Asia,Asia,"Chiang Rai, Loei, Nakhon Phanom, Nan, Nong Khai, Phayao, Phitsanulok, Sakon Nakhon, Udon Thani, Uttaradit provinces",,Flood,,,,,,,Kph,17.31,103.66,,,2008,8.0,11.0,2008,8.0,20.0,,,,,,,,,,,,79.4563043953641,1,2860;2870;2877;2881;2884;2891;2895;2905;2922;2924,,"Chiang Rai, Loei, Nakhon Phanom, Nan, Nong Khai, Phayao, Phitsanulok, Sakon Nakhon, Udon Thani, Uttaradit (Adm1)."
2011-0272-THA,2011,272,TC-2011-000095,Natural,Meteorological,Storm,Tropical cyclone,,Topical storm Juaning (Nock-ten),Thailand,THA,South-Eastern Asia,Asia,"Phrae, Chiang Mai, Sukhothai, Nan, Nakhon Phanom, Lamphun, Lampang, Mae Hon Son, Uttaradit, Phichit, Phitsanulok, Udon Thani, Nong Khai, Sakon Nakhon Loei, Phetchabun provinces",,Flood,,,,Yes,,,Kph,,,,,2011,8.0,4.0,2011,8.0,6.0,18.0,,1000000.0,,1000000.0,,,,,,,83.0126743931774,1,2859;2868;2869;2870;2872;2877;2881;2884;2892;2894;2895;2897;2905;2914;2922;2924,,"Chiang Mai, Lampang, Lamphun, Loei, Mae Hong Son, Nakhon Phanom, Nan, Nong Khai, Phetchabun, Phichit, Phitsanulok, Phrae, Sakon Nakhon, Sukhothai, Udon Thani, Uttaradit (Adm1)."
2014-0537-THA,2014,537,,Natural,Meteorological,Storm,Convective storm,Lightning/Thunderstorms,,Thailand,THA,South-Eastern Asia,Asia,"Chiang Mai, Chiang Rai, Lampang, Lamphun, Mae Hong Son, Nan, Phayao, Phrae, Sukhothai, Tak, Uttaradit provinces",,Hail,,,,,,,Kph,,,,,2014,3.0,16.0,2014,3.0,16.0,,,,2000.0,2000.0,,,,,,,87.3662978351193,1,2859;2860;2868;2869;2872;2881;2891;2897;2914;2918;2924,,"Chiang Mai, Chiang Rai, Lampang, Lamphun, Mae Hong Son, Nan, Phayao, Phrae, Sukhothai, Tak, Uttaradit (Adm1)."
2015-0620-THA,2015,620,,Natural,Meteorological,Storm,Tropical cyclone,,Cyclone Vamco,Thailand,THA,South-Eastern Asia,Asia,"Rayong (Muang, Bang Chang districts), Chonburi, Phang-nga, Chumphon, Trat, Saraburi, Ranong, Satun, Tak, Chanthaburi, Surin, Si Sa Ket, Trang, Chachoengsao, Nakhon Nayok, Krabi, Phatthlung, Nakhon Si Thammarat, Prachuap Khiri Khan, Prachinburi, Surat Thani, Phetchaburi (Ban Laem district), Sa Kaeo Provinces",,Flood,,,,,,65.0,Kph,,,,,2015,9.0,15.0,2015,9.0,21.0,3.0,,,,,,,,,561.0,641.0,87.4699322108025,1,2855;2858;2861;2862;2867;2875;2880;2888;2889;2890;2893;2899;2900;2902;2904;2909;2910;2911;2916;2917;2918;2919;2920,,"Chachoengsao, Chanthaburi, Chonburi, Chumphon, Krabi, Nakhon Nayok, Nakhon Si Thammarat, Phachinburi, Phangnga, Phatthalung, Phetchaburi, Prachuap Khilikhan, Ranong, Rayong, Sa Kaeo, Saraburi, Satun, Si Saket, Surat Thani, Surin, Tak, Trad, Trang (Adm1)."
2017-0281-THA,2017,281,,Natural,Meteorological,Storm,Tropical cyclone,,Tropical Storm Talas,Thailand,THA,South-Eastern Asia,Asia,Nan (Mae Charim district),,,,,,,,,Kph,,,,Nan,2017,7.0,17.0,2017,7.0,19.0,,,60.0,,60.0,,,,,,,90.4601793133611,1,2881,,Nan (Adm1).
2017-0406-THA,2017,406,TC-2017-000131,Natural,Meteorological,Storm,Tropical cyclone,,Typhoon 'Doksuri',Thailand,THA,South-Eastern Asia,Asia,"Uthai Thani, Phitsanulok, Phrae, Chaiyaphum, Chiang Rai, Kalasin, Lampang, Loei, Phangnga, Phetchabun, Sakon Nakhon, Satun, Uttaradit",,Flood,,,,,,,Kph,,,,,2017,9.0,17.0,2017,9.0,17.0,,,28500.0,,28500.0,,,,,,,90.4601793133611,1,2857;2860;2863;2868;2870;2889;2892;2895;2897;2905;2910;2923;2924,,"Chaiyaphum, Chiang Rai, Kalasin, Lampang, Loei, Phangnga, Phetchabun, Phitsanulok, Phrae, Sakon Nakhon, Satun, Uthai Thani, Uttaradit (Adm1)."
2019-0009-THA,2019,9,,Natural,Meteorological,Storm,Tropical cyclone,,Tropical cylone 'Pabuk',Thailand,THA,South-Eastern Asia,Asia,"Nakhon Si Thammarat, Surat Thani provinces",,,,,,,,,Kph,,,,,2019,1.0,4.0,2019,1.0,4.0,7.0,,720885.0,,720885.0,,,,,,,94.3490924994534,1,2880;2916,,"Nakhon Si Thammarat, Surat Thani (Adm1)."
2020-0199-THA,2020,199,,Natural,Meteorological,Storm,Convective storm,Severe storm,,Thailand,THA,South-Eastern Asia,Asia,,,,,,,,,,Kph,,,,,2020,4.0,29.0,2020,5.0,9.0,2.0,2.0,50500.0,,50502.0,,,,,10000.0,10470.0,95.5129674174503,1,2851;2852;2853;2854;2855;2856;2857;2858;2859;2860;2861;2862;2863;2864;2865;2866;2867;2868;2869;2870;2871;2872;2873;2874;2875;2876;2877;2878;2879;2880;2881;2882;2883;2884;2885;2886;2887;2888;2889;2890;2891;2892;2893;2894;2895;2896;2897;2898;2899;2900;2901;2902;2903;2904;2905;2906;2907;2908;2909;2910;2911;2912;2913;2914;2915;2916;2917;2918;2919;2920;2921;2922;2923;2924;2925;2926,,"Amnat Charoen, Ang Thong, Bangkok, Buriram, Chachoengsao, Chainat, Chaiyaphum, Chanthaburi, Chiang Mai, Chiang Rai, Chonburi, Chumphon, Kalasin, Kampaeng Phet, Kanchanaburi, Khon Kaen, Krabi, Lampang, Lamphun, Loei, Lopburi, Mae Hong Son, Maha Sarakham, Mukdahan, Nakhon Nayok, Nakhon Pathom, Nakhon Phanom, Nakhon Ratchasima, Nakhon Sawan, Nakhon Si Thammarat, Nan, Narathiwat, Nong Bua Lamphu, Nong Khai, Nonthaburi, Pathum Thani, Pattani, Phachinburi, Phangnga, Phatthalung, Phayao, Phetchabun, Phetchaburi, Phichit, Phitsanulok, Phra Nakhon Si Ayudhya, Phrae, Phuket, Prachuap Khilikhan, Ranong, Ratchaburi, Rayong, Roi Et, Sa Kaeo, Sakon Nakhon, Samut Prakarn, Samut Sakhon, Samut Songkham, Saraburi, Satun, Si Saket, Singburi, Songkhla, Sukhothai, Suphanburi, Surat Thani, Surin, Tak, Trad, Trang, Ubon Ratchathani, Udon Thani, Uthai Thani, Uttaradit, Yala, Yasothon (Adm1)."
2020-0307-THA,2020,307,,Natural,Meteorological,Storm,Tropical cyclone,,Tropical cyclone 'Sinlaku',Thailand,THA,South-Eastern Asia,Asia,Loei Province,,Flood,Surge,,,,,75.0,Kph,,,,,2020,8.0,1.0,2020,8.0,3.0,4.0,,,,,,,,,,,95.5129674174503,1,2870,,Loei (Adm1).
2020-0462-THA,2020,462,,Natural,Meteorological,Storm,Tropical cyclone,,Tropical storm 'Noul' (Leon),Thailand,THA,South-Eastern Asia,Asia,"Mae Hong Son, Chiang Mai, Uttaradit, Sukhothai, Tak, Kamphaeng Phet, Phitsanulok, Phichit, Phetchabun (North); Chaiyaphum, Nakhon Ratchasima (NothEast); Ratchaburi, Kanchanaburi, Uthai Thani, Chai Nat, Nakhon Sawan, Lop Buri and Saraburi (Central); Nakhon Nayok, Prachin Buri, Chanthaburi, Trat (East); Phetchaburi, Prachuap Khiri Khan, Chumphon, Ranong, Phangnga, Phuket (South)",,Flood,,,,,,,Kph,,,,,2020,9.0,18.0,2020,9.0,21.0,1.0,,,,,,,,,,,95.5129674174503,1,2856;2857;2858;2859;2862;2864;2865;2871;2872;2875;2878;2879;2888;2889;2892;2893;2894;2895;2898;2899;2900;2901;2909;2914;2918;2919;2923;2924,,"Chainat, Chaiyaphum, Chanthaburi, Chiang Mai, Chumphon, Kampaeng Phet, Kanchanaburi, Lopburi, Mae Hong Son, Nakhon Nayok, Nakhon Ratchasima, Nakhon Sawan, Phachinburi, Phangnga, Phetchabun, Phetchaburi, Phichit, Phitsanulok, Phuket, Prachuap Khilikhan, Ranong, Ratchaburi, Saraburi, Sukhothai, Tak, Trad, Uthai Thani, Uttaradit (Adm1)."
2020-0411-THA,2020,411,FL-2020-000211,Natural,Meteorological,Storm,Tropical cyclone,,Tropical storm Linfa,Thailand,THA,South-Eastern Asia,Asia,"Central and eastern Provinces, Nakhon Nayok,Trang, Satun, Songkhla,Sa Kaeo.",,,,,,,,,Kph,,,,,2020,10.0,9.0,2020,10.0,31.0,6.0,,274923.0,,274923.0,,,,,,,95.5129674174503,1,2852;2853;2855;2856;2858;2861;2864;2871;2875;2877;2879;2885;2886;2888;2892;2894;2895;2896;2902;2904;2906;2907;2908;2909;2910;2912;2913;2914;2915;2919;2920;2923,,"Ang Thong, Bangkok, Chachoengsao, Chainat, Chanthaburi, Chonburi, Kampaeng Phet, Lopburi, Nakhon Nayok, Nakhon Phanom, Nakhon Sawan, Nonthaburi, Pathum Thani, Phachinburi, Phetchabun, Phichit, Phitsanulok, Phra Nakhon Si Ayudhya, Rayong, Sa Kaeo, Samut Prakarn, Samut Sakhon, Samut Songkham, Saraburi, Satun, Singburi, Songkhla, Sukhothai, Suphanburi, Trad, Trang, Uthai Thani (Adm1)."
2021-0171-THA,2021,171,,Natural,Meteorological,Storm,Convective storm,Severe storm,,Thailand,THA,South-Eastern Asia,Asia,Northern and eastern provinces,,Lightening,,,,,,,Kph,,,,,2021,3.0,22.0,2021,3.0,23.0,2.0,,,900.0,900.0,,,,,,,100.0,,,,
2022-0271-THA,2022,271,,Natural,Meteorological,Storm,Convective storm,Severe storm,,Thailand,THA,South-Eastern Asia,Asia,"Chiang Mai, Nakhon Phanom, Chumphon, Surat Thani, Nakhon Si Thammarat",,Flood,,,,,,,Kph,,,,,2022,5.0,5.0,2022,5.0,9.0,1.0,,1050.0,,1050.0,,,,,,,,1,2859;2862;2877;2880;2916,,"Chiang Mai, Chumphon, Nakhon Phanom, Nakhon Si Thammarat, Surat Thani (Adm1)."
2022-0613-THA,2022,613,TC-2022-000318,Natural,Meteorological,Storm,Convective storm,Storm/Surge,Tropical cyclone 'Noru' (Karding),Thailand,THA,South-Eastern Asia,Asia,Sisaket Province,,,,,,,,,Kph,,,,,2022,9.0,28.0,2022,9.0,29.0,1.0,2.0,,,2.0,,,,,,,,1,2911,,Si Saket (Adm1).
